,conference,year,title,id,authors,tags,notes
1072,kbse/ase,2018,Self-protection of Android systems from inter-component communication attacks.,conf/kbse/HammadGM18,"Mahmoud Hammad, Joshua Garcia, Sam Malek",Mobile Security,
1073,kbse/ase,2018,An empirical study of Android test generation tools in industrial cases.,conf/kbse/WangLYCZDX18,"Wenyu Wang, Dengfeng Li, Wei Yang, Yurui Cao, Zhenwen Zhang, Yuetang Deng, Tao Xie",,Experience Papers
1074,kbse/ase,2018,Achieving test automation with testers without coding skills: an industrial report.,conf/kbse/GafurovHM18,"Davrondzhon Gafurov, Arne Erik Hurum, Martin Markman",,Experience Papers
1075,kbse/ase,2018,Navigating the maze: the impact of configurability in bioinformatics software.,conf/kbse/CashmanCRC18,"Mikaela Cashman, Myra B. Cohen, Priya Ranjan, Robert W. Cottingham",,Experience Papers
1076,kbse/ase,2018,Automatically testing implementations of numerical abstract domains.,conf/kbse/BugariuWC018,"Alexandra Bugariu, Valentin Wüstholz, Maria Christakis, Peter Müller",,Experience Papers
1077,kbse/ase,2018,Experiences applying automated architecture analysis tool suites.,conf/kbse/MoSCRKN18,"Ran Mo, Will Snipes, Yuanfang Cai, Srini Ramaswamy, Rick Kazman, Martin Naedele",,Experience Papers
1078,kbse/ase,2018,Continuous code quality: are we (really) doing that?,conf/kbse/VassalloPBG18,"Carmine Vassallo, Fabio Palomba, Alberto Bacchelli, Harald C. Gall",,New Ideas Papers
1079,kbse/ase,2018,RUDSEA: recommending updates of Dockerfiles via software environment analysis.,conf/kbse/HassanRW18,"Foyzul Hassan, Rodney Rodriguez, Xiaoyin Wang",,New Ideas Papers
1080,kbse/ase,2018,Delta debugging microservice systems.,conf/kbse/ZhouPX0LJD18,"Xiang Zhou, Xin Peng, Tao Xie, Jun Sun, Wenhai Li, Chao Ji, Dan Ding",,New Ideas Papers
1081,kbse/ase,2018,Personalized teammate recommendation for crowdsourced software developers.,conf/kbse/Ye0WW18,"Luting Ye, Hailong Sun, Xu Wang, Jiaruijue Wang",,New Ideas Papers
1082,kbse/ase,2018,S-gram: towards semantic-aware security auditing for Ethereum smart contracts.,conf/kbse/LiuLZJS18,"Han Liu, Chao Liu, Wenqi Zhao, Yu Jiang, Jiaguang Sun",,New Ideas Papers
1083,kbse/ase,2018,An evolutionary approach for analyzing Alloy specifications.,conf/kbse/WangBC18,"Jianghao Wang, Hamid Bagheri, Myra B. Cohen",,New Ideas Papers
1084,kbse/ase,2018,A neural framework for retrieval and summarization of source code.,conf/kbse/ChenZ18,"Qingying Chen, Minghui Zhou",,New Ideas Papers
1085,kbse/ase,2018,An empirical investigation into learning bug-fixing patches in the wild via neural machine translation.,conf/kbse/TufanoWBPWP18,"Michele Tufano, Cody Watson, Gabriele Bavota, Massimiliano Di Penta, Martin White, Denys Poshyvanyk",,New Ideas Papers
1086,kbse/ase,2018,Loop path reduction by state pruning.,conf/kbse/GaoL18,"Jianxiong Gao, Steven S. Lumetta",,New Ideas Papers
1087,kbse/ase,2018,node2defect: using network embedding to improve software defect prediction.,conf/kbse/QuLCJCHZ18,"Yu Qu, Ting Liu, Jianlei Chi, Yangxu Jin, Di Cui, Ancheng He, Qinghua Zheng",,New Ideas Papers
1088,kbse/ase,2018,Towards automating disambiguation of regulations: using the wisdom of crowds.,conf/kbse/PatwardhanSSKG18,"Manasi Patwardhan, Abhishek Sainani, Richa Sharma, Shirish Karande, Smita Ghaisas",,New Ideas Papers
1089,kbse/ase,2018,jStanley: placing a green thumb on Java collections.,conf/kbse/PereiraSCS18,"Rui Pereira, Pedro Simão, Jácome Cunha, João Saraiva",Tool,Tool Demonstrations
1090,kbse/ase,2018,SRCIROR: a toolset for mutation testing of C source code and LLVM intermediate representation.,conf/kbse/HaririS18,"Farah Hariri, August Shi",Tool,Tool Demonstrations
1091,kbse/ase,2018,Lightweight source code monitoring with Triggr.,conf/kbse/OzdemirTEA18,"Alim Ozdemir, Ayse Tosun, Hakan Erdogmus, Rui Abreu",Tool,Tool Demonstrations
1092,kbse/ase,2018,OCELOT: a search-based test-data generation tool for C.,conf/kbse/ScalabrinoGNGLG18,"Simone Scalabrino, Giovanni Grano, Dario Di Nucci, Michele Guerra, Andrea De Lucia, Harald C. Gall, Rocco Oliveto",Tool,Tool Demonstrations
1093,kbse/ase,2018,Live versioning of web applications through refactoring.,conf/kbse/GrigeraGGR18,"Julián Grigera, Juan Cruz Gardey, Alejandra Garrido, Gustavo Rossi",Tool,Tool Demonstrations
1094,kbse/ase,2018,code_call_lens: raising the developer awareness of critical code.,conf/kbse/JanesMR18,"Andrea Janes, Michael Mairegger, Barbara Russo",Tool,Tool Demonstrations
1095,kbse/ase,2018,Code2graph: automatic generation of static call graphs for Python source code.,conf/kbse/GharibiTL18,"Gharib Gharibi, Rashmi Tripathi, Yugyung Lee",Tool,Tool Demonstrations
1096,kbse/ase,2018,The electrum analyzer: model checking relational first-order temporal specifications.,conf/kbse/BrunelCCM18,"Julien Brunel, David Chemouil, Alcino Cunha, Nuno Macedo",Tool,Tool Demonstrations
1097,kbse/ase,2018,ESBMC 5.0: an industrial-strength C model checker.,conf/kbse/GadelhaMMC0N18,"Mikhail Y. R. Gadelha, Felipe R. Monteiro, Jeremy Morse, Lucas C. Cordeiro, Bernd Fischer, Denis A. Nicole",Tool,Tool Demonstrations
1098,kbse/ase,2018,L-CMP: an automatic learning-based parameterized verification tool.,conf/kbse/CaoLP18,"Jialun Cao, Yongjian Li, Jun Pang",Tool,Tool Demonstrations
1099,kbse/ase,2018,VulSeeker: a semantic learning based vulnerability seeker for cross-platform binary.,conf/kbse/GaoYFJS18,"Jian Gao, Xin Yang, Ying Fu, Yu Jiang, Jiaguang Sun",Tool,Tool Demonstrations
1100,kbse/ase,2018,CPA-SymExec: efficient symbolic execution in CPAchecker.,conf/kbse/0001018,"Dirk Beyer, Thomas Lemberger",Tool,Tool Demonstrations
1101,kbse/ase,2018,CANAL: a cache timing analysis framework via LLVM transformation.,conf/kbse/SungPW18,"Chungha Sung, Brandon Paulsen, Chao Wang",Tool,Tool Demonstrations
1102,kbse/ase,2018,Descartes: a PITest engine to detect pseudo-tested methods: tool demonstration.,conf/kbse/Vera-PerezMB18,"Oscar Luis Vera-Pérez, Martin Monperrus, Benoit Baudry",Tool,Tool Demonstrations
1103,kbse/ase,2018,DKVF: a framework for rapid prototyping and evaluating distributed key-value stores.,conf/kbse/RoohitavafK18,"Mohammad Roohitavaf, Sandeep S. Kulkarni",Tool,Tool Demonstrations
1104,kbse/ase,2018,DroidMate-2: a platform for Android test generation.,conf/kbse/BorgesHZ18,"Nataniel P. Borges Jr., Jenny Hotzkow, Andreas Zeller",Tool,Tool Demonstrations
1105,kbse/ase,2018,Assessing and evaluating functional suitability of software.,conf/kbse/Haindl18,Philipp Haindl,,Session 1
1106,kbse/ase,2018,Automatic mining of constraints for monitoring systems of systems.,conf/kbse/Krismayer18,Thomas Krismayer,,Session 2
1107,kbse/ase,2018,Towards automatic restrictification of CUDA kernel arguments.,conf/kbse/Diarra18,Rokiatou Diarra,,Session 2
1108,kbse/ase,2018,A DSL for requirements in the context of a seamless approach.,conf/kbse/Galinier18,Florian Galinier,,Session 2
1109,kbse/ase,2018,A multi-objective framework for effective performance fault injection in distributed systems.,conf/kbse/Traini18,Luca Traini,,Session 3
1110,kbse/ase,2018,Top-down model-driven engineering of web services from extended OpenAPI models.,conf/kbse/Sferruzza18,David Sferruzza,,Session 3
1111,kbse/ase,2018,Differential program analysis with fuzzing and symbolic execution.,conf/kbse/Noller18,Yannic Noller,,Session 3
1112,kbse/ase,2018,Software engineering techniques applied to relational databases.,conf/kbse/Delplanque18,Julien Delplanque,,Session 3
1113,kbse/ase,2018,Automatically quantifying the impact of a change in systems (journal-first abstract).,conf/kbse/AlmasriTK18,"Nada Almasri, Luay Tahat, Bogdan Korel",,Journal-First Papers
1114,kbse/ase,2018,Estimating the number of remaining links in traceability recovery (journal-first abstract).,conf/kbse/FalessiPCC18,"Davide Falessi, Massimiliano Di Penta, Gerardo Canfora, Giovanni Cantone",,Journal-First Papers
1115,kbse/ase,2018,Bounded model checking of C++ programs based on the Qt cross-platform framework (journal-first abstract).,conf/kbse/MonteiroGCF18,"Felipe R. Monteiro, Mário A. P. Garcia, Lucas C. Cordeiro, Eddie Batista de Lima Filho",,Journal-First Papers
1116,kbse/ase,2018,Understanding Semi-structured merge conflict characteristics in open-source Java projects (journal-first abstract).,conf/kbse/AcciolyBC18,"Paola R. G. Accioly, Paulo Borba, Guilherme Cavalcanti",,Journal-First Papers
1117,kbse/ase,2019,Assessing the Generalizability of Code2vec Token Embeddings.,conf/kbse/KangB019,"Hong Jin Kang, Tegawendé F. Bissyandé, David Lo",,Main Track
1118,kbse/ase,2019,Multi-modal Attention Network Learning for Semantic Source Code Retrieval.,conf/kbse/WanSSXZ0Y19,"Yao Wan, Jingdong Shu, Yulei Sui, Guandong Xu, Zhou Zhao, Jian Wu, Philip S. Yu",,Main Track
1119,kbse/ase,2019,Experience Paper: Search-Based Testing in Automated Driving Control Applications.,conf/kbse/Gladisch0HOVP19,"Christoph Gladisch, Thomas Heinz, Christian Heinzemann, Jens Oehlerking, Anne von Vietinghoff, Tim Pfitzer",,Main Track
1120,kbse/ase,2019,AutoFocus: Interpreting Attention-Based Neural Networks by Code Perturbation.,conf/kbse/BuiYJ19,"Nghi D. Q. Bui, Yijun Yu, Lingxiao Jiang",,Main Track
1121,kbse/ase,2019,Test Transfer Across Mobile Apps Through Semantic Mapping.,conf/kbse/LinJM19,"Jun-Wei Lin, Reyhaneh Jabbarvand, Sam Malek",,Main Track
1122,kbse/ase,2019,Test Migration Between Mobile Apps with Similar Functionality.,conf/kbse/BehrangO19,"Farnaz Behrang, Alessandro Orso",,Main Track
1123,kbse/ase,2019,DaPanda: Detecting Aggressive Push Notifications in Android Apps.,conf/kbse/LiuW0B0X19,"Tianming Liu, Haoyu Wang, Li Li, Guangdong Bai, Yao Guo, Guoai Xu",,Main Track
1124,kbse/ase,2019,Automatic Self-Validation for Code Coverage Profilers.,conf/kbse/YangJ0WSLZX19,"Yibiao Yang, Yanyan Jiang, Zhiqiang Zuo, Yang Wang, Hao Sun, Hongmin Lu, Yuming Zhou, Baowen Xu",,Main Track
1125,kbse/ase,2019,Efficient Test Generation Guided by Field Coverage Criteria.,conf/kbse/GodioBPAF19,"Ariel Godio, Valeria S. Bengolea, Pablo Ponzio, Nazareno Aguirre, Marcelo Fabian Frias",,Main Track
1126,kbse/ase,2019,A Qualitative Analysis of Android Taint-Analysis Results.,conf/kbse/LuoBS19,"Linghui Luo, Eric Bodden, Johannes Späth",,Main Track
1127,kbse/ase,2019,Goal-Driven Exploration for Android Applications.,conf/kbse/LaiR19,"Duling Lai, Julia Rubin",,Main Track
1128,kbse/ase,2019,RANDR: Record and Replay for Android Applications via Targeted Runtime Instrumentation.,conf/kbse/SahinAMCE19,"Onur Sahin, Assel Aliyeva, Hariharan Mathavan, Ayse K. Coskun, Manuel Egele",,Main Track
1129,kbse/ase,2019,MalScan: Fast Market-Wide Mobile Malware Scanning by Social-Network Centrality Analysis.,conf/kbse/WuLZYZ019,"Yueming Wu, Xiaodi Li, Deqing Zou, Wei Yang, Xin Zhang, Hai Jin",,Main Track
1130,kbse/ase,2019,"Discovering, Explaining and Summarizing Controversial Discussions in Community Q&A Sites.",conf/kbse/RenX00S19,"Xiaoxue Ren, Zhenchang Xing, Xin Xia, Guoqiang Li, Jianling Sun",,Main Track
1131,kbse/ase,2019,Automating App Review Response Generation.,conf/kbse/GaoZX0LK19,"Cuiyun Gao, Jichuan Zeng, Xin Xia, David Lo, Michael R. Lyu, Irwin King",,Main Track
1132,kbse/ase,2019,Automatic Generation of Pull Request Descriptions.,conf/kbse/Liu0T0L19,"Zhongxin Liu, Xin Xia, Christoph Treude, David Lo, Shanping Li",,Main Track
1133,kbse/ase,2019,Systematically Covering Input Structure.,conf/kbse/HavrikovZ19,"Nikolas Havrikov, Andreas Zeller",,Main Track
1134,kbse/ase,2019,SEGATE: Unveiling Semantic Inconsistencies between Code and Specification of String Inputs.,conf/kbse/SondhiP19,"Devika Sondhi, Rahul Purandare",,Main Track
1135,kbse/ase,2019,Detecting Error-Handling Bugs without Error Specification Input.,conf/kbse/JiaLYLWLL19,"Zhouyang Jia, Shanshan Li, Tingting Yu, Xiangke Liao, Ji Wang, Xiaodong Liu, Yunhuai Liu",,Main Track
1136,kbse/ase,2019,Grading-Based Test Suite Augmentation.,conf/kbse/Osei-OwusuAB0C19,"Jonathan Osei-Owusu, Angello Astorga, Liia Butler, Tao Xie, Geoffrey Challen",,Main Track
1137,kbse/ase,2019,Emotions Extracted from Text vs. True Emotions-An Empirical Evaluation in SE Context.,conf/kbse/Wang19,Yi Wang,,Main Track
1138,kbse/ase,2019,Learning from Examples to Find Fully Qualified Names of API Elements in Code Snippets.,conf/kbse/SaifullahAR19,"C. M. Khaled Saifullah, Muhammad Asaduzzaman, Chanchal K. Roy",,Main Track
1139,kbse/ase,2019,Inferring Program Transformations From Singular Examples via Big Code.,conf/kbse/JiangRXZ19,"Jiajun Jiang, Luyao Ren, Yingfei Xiong, Lingming Zhang",,Main Track
1140,kbse/ase,2019,Performance-Boosting Sparsification of the IFDS Algorithm with Applications to Taint Analysis.,conf/kbse/HeLWMZLHLX19,"Dongjie He, Haofeng Li, Lei Wang, Haining Meng, Hengjie Zheng, Jie Liu, Shuangwei Hu, Lian Li, Jingling Xue",,Main Track
1141,kbse/ase,2019,Characterizing Android App Signing Issues.,conf/kbse/WangLXMG19,"Haoyu Wang, Hongxuan Liu, Xusheng Xiao, Guozhu Meng, Yao Guo",,Main Track
1142,kbse/ase,2019,OAUTHLINT: An Empirical Study on OAuth Bugs in Android Applications.,conf/kbse/RahatFT19,"Tamjid Al Rahat, Yu Feng, Yuan Tian",,Main Track
1143,kbse/ase,2019,History-Guided Configuration Diversification for Compiler Test-Program Generation.,conf/kbse/0003WHX0019,"Junjie Chen, Guancheng Wang, Dan Hao, Yingfei Xiong, Hongyu Zhang, Lu Zhang",,Main Track
1144,kbse/ase,2019,ReduKtor: How We Stopped Worrying About Bugs in Kotlin Compiler.,conf/kbse/StepanovAB19,"Daniil Stepanov, Marat Akhin, Mikhail A. Belyaev",,Main Track
1145,kbse/ase,2019,Targeted Example Generation for Compilation Errors.,conf/kbse/AhmedSSK19,"Umair Z. Ahmed, Renuka Sindhgatta, Nisheeth Srivastava, Amey Karkare",,Main Track
1146,kbse/ase,2019,Understanding Exception-Related Bugs in Large-Scale Cloud Systems.,conf/kbse/ChenD0Q19,"Haicheng Chen, Wensheng Dou, Yanyan Jiang, Feng Qin",,Main Track
1147,kbse/ase,2019,iFeedback: Exploiting User Feedback for Real-Time Issue Detection in Large-Scale Online Service Systems.,conf/kbse/ZhengLZLZD19,"Wujie Zheng, Haochuan Lu, Yangfan Zhou, Jianming Liang, Haibing Zheng, Yuetang Deng",,Main Track
1148,kbse/ase,2019,Continuous Incident Triage for Large-Scale Online Service Systems.,conf/kbse/0003HL0HGXDZ19,"Junjie Chen, Xiaoting He, Qingwei Lin, Hongyu Zhang, Dan Hao, Feng Gao, Zhangwei Xu, Yingnong Dang, Dongmei Zhang",,Main Track
1149,kbse/ase,2019,Apricot: A Weight-Adaptation Approach to Fixing Deep Learning Models.,conf/kbse/ZhangC19,"Hao Zhang, W. K. Chan",,Main Track
1150,kbse/ase,2019,Re-Factoring Based Program Repair Applied to Programming Assignments.,conf/kbse/HuAMLR19,"Yang Hu, Umair Z. Ahmed, Sergey Mechtaev, Ben Leong, Abhik Roychoudhury",,Main Track
1151,kbse/ase,2019,InFix: Automatically Repairing Novice Program Inputs.,conf/kbse/EndresSCJW19,"Madeline Endres, Georgios Sakkas, Benjamin Cosman, Ranjit Jhala, Westley Weimer",,Main Track
1152,kbse/ase,2019,Understanding Automatically-Generated Patches Through Symbolic Invariant Differences.,conf/kbse/CashinMWF19,"Padraic Cashin, Carianne Martinez, Westley Weimer, Stephanie Forrest",,Main Track
1153,kbse/ase,2019,"Regexes are Hard: Decision-Making, Difficulties, and Risks in Programming Regular Expressions.",conf/kbse/MichaelDDLS19,"Louis G. Michael IV, James Donohue, James C. Davis, Dongyoon Lee, Francisco Servant",,Main Track
1154,kbse/ase,2019,Testing Regex Generalizability And Its Implications: A Large-Scale Many-Language Measurement Study.,conf/kbse/DavisMKL19,"James C. Davis, Daniel Moyer, Ayaan M. Kazerouni, Dongyoon Lee",,Main Track
1155,kbse/ase,2019,Accurate String Constraints Solution Counting with Weighted Automata.,conf/kbse/ShermanH19,"Elena Sherman, Andrew Harris",,Main Track
1156,kbse/ase,2019,Subformula Caching for Model Counting and Quantitative Program Analysis.,conf/kbse/EiersSBB19,"William Eiers, Seemanta Saha, Tegan Brennan, Tevfik Bultan",,Main Track
1157,kbse/ase,2019,ACTGAN: Automatic Configuration Tuning for Software Systems with Generative Adversarial Networks.,conf/kbse/BaoLWF19,"Liang Bao, Xin Liu, Fangzheng Wang, Baoyin Fang",,Main Track
1158,kbse/ase,2019,V2: Fast Detection of Configuration Drift in Python.,conf/kbse/HortonP19,"Eric Horton, Chris Parnin",,Main Track
1159,kbse/ase,2019,Feature-Interaction Aware Configuration Prioritization for Configurable Code.,conf/kbse/NguyenNTTN19,"Son Nguyen, Hoan Nguyen, Ngoc M. Tran, Hieu Tran, Tien N. Nguyen",,Main Track
1160,kbse/ase,2019,Combining Spectrum-Based Fault Localization and Statistical Debugging: An Empirical Study.,conf/kbse/JiangWXCZ19,"Jiajun Jiang, Ran Wang, Yingfei Xiong, Xiangping Chen, Lu Zhang",,Main Track
1161,kbse/ase,2019,SCMiner: Localizing System-Level Concurrency Faults from Large System Call Traces.,conf/kbse/ZamanHY19,"Tarannum Shaila Zaman, Xue Han, Tingting Yu",,Main Track
1162,kbse/ase,2019,Root Cause Localization for Unreproducible Builds via Causality Analysis Over System Call Tracing.,conf/kbse/RenLXJX19,"Zhilei Ren, Changlin Liu, Xusheng Xiao, He Jiang, Tao Xie",,Main Track
1163,kbse/ase,2019,Mutation Analysis for Coq.,conf/kbse/CelikPPAG19,"Ahmet Çelik, Karl Palmskog, Marinela Parovic, Emilio Jesús Gallego Arias, Milos Gligoric",,Main Track
1164,kbse/ase,2019,Verifying Arithmetic in Cryptographic C Programs.,conf/kbse/LiuSTWY19,"Jiaxiang Liu, Xiaomu Shi, Ming-Hsien Tsai, Bow-Yaw Wang, Bo-Yin Yang",,Main Track
1165,kbse/ase,2019,Model Checking Embedded Control Software using OS-in-the-Loop CEGAR.,conf/kbse/KimC19,"Dongwoo Kim, Yunja Choi",,Main Track
1166,kbse/ase,2019,Get Rid of Inline Assembly through Verification-Oriented Lifting.,conf/kbse/RecoulesBBMP19,"Frédéric Recoules, Sébastien Bardin, Richard Bonichon, Laurent Mounier, Marie-Laure Potet",,Main Track
1167,kbse/ase,2019,CodeKernel: A Graph Kernel Based Approach to the Selection of API Usage Examples.,conf/kbse/Gu0019,"Xiaodong Gu, Hongyu Zhang, Sunghun Kim",,Main Track
1168,kbse/ase,2019,Machine Learning Based Recommendation of Method Names: How Far are We.,conf/kbse/JiangLJ19,"Lin Jiang, Hui Liu, He Jiang",,Main Track
1169,kbse/ase,2019,MARBLE: Mining for Boilerplate Code to Identify API Usability Problems.,conf/kbse/NamHMMV19,"Daye Nam, Amber Horvath, Andrew Macvean, Brad A. Myers, Bogdan Vasilescu",,Main Track
1170,kbse/ase,2019,DIRE: A Neural Approach to Decompiled Identifier Naming.,conf/kbse/LacomisYSAGNV19,"Jeremy Lacomis, Pengcheng Yin, Edward J. Schwartz, Miltiadis Allamanis, Claire Le Goues, Graham Neubig, Bogdan Vasilescu",,Main Track
1171,kbse/ase,2019,Accurate Modeling of Performance Histories for Evolving Software Systems.,conf/kbse/MuhlbauerAS19,"Stefan Mühlbauer, Sven Apel, Norbert Siegmund",,Main Track
1172,kbse/ase,2019,An Industrial Experience Report on Performance-Aware Refactoring on a Database-Centric Web Application.,conf/kbse/ChenJML19,"Boyuan Chen, Zhen Ming Jiang, Paul Matos, Michael Lacaria",,Main Track
1173,kbse/ase,2019,How Do API Selections Affect the Runtime Performance of Data Analytics Tasks?,conf/kbse/TaoTLXQ19,"Yida Tao, Shan Tang, Yepang Liu, Zhiwu Xu, Shengchao Qin",,Main Track
1174,kbse/ase,2019,An Experience Report of Generating Load Tests Using Log-Recovered Workloads at Varying Granularities of User Behaviour.,conf/kbse/ChenSHWL19,"Jinfu Chen, Weiyi Shang, Ahmed E. Hassan, Yong Wang, Jiangbin Lin",,Main Track
1175,kbse/ase,2019,Demystifying Application Performance Management Libraries for Android.,conf/kbse/TangZZLXZY19,"Yutian Tang, Xian Zhan, Hao Zhou, Xiapu Luo, Zhou Xu, Yajin Zhou, Qiben Yan",,Main Track
1176,kbse/ase,2019,Predicting Licenses for Changed Source Code.,conf/kbse/LiuHGN19,"Xiaoyu Liu, LiGuo Huang, Jidong Ge, Vincent Ng",,Main Track
1177,kbse/ase,2019,Empirical Evaluation of the Impact of Class Overlap on Software Defect Prediction.,conf/kbse/GongJWJ19,"Lina Gong, Shujuan Jiang, Rongcun Wang, Li Jiang",,Main Track
1178,kbse/ase,2019,Combining Program Analysis and Statistical Language Model for Code Statement Completion.,conf/kbse/NguyenNLW19,"Son Nguyen, Tien N. Nguyen, Yi Li, Shaohua Wang",,Main Track
1179,kbse/ase,2019,MAP-Coverage: A Novel Coverage Criterion for Testing Thread-Safe Classes.,conf/kbse/WangZL00L19,"Zan Wang, Yingquan Zhao, Shuang Liu, Jun Sun, Xiang Chen, Huarui Lin",,Main Track
1180,kbse/ase,2019,Automating Non-Blocking Synchronization In Concurrent Data Abstractions.,conf/kbse/ZhangYD19,"Jiange Zhang, Qing Yi, Damian Dechev",,Main Track
1181,kbse/ase,2019,Automating CUDA Synchronization via Program Transformation.,conf/kbse/WuZ0TZ19,"Mingyuan Wu, Lingming Zhang, Cong Liu, Shin Hwei Tan, Yuqun Zhang",,Main Track
1182,kbse/ase,2019,Efficient Transaction-Based Deterministic Replay for Multi-threaded Programs.,conf/kbse/PobeeMC19,"Ernest Bota Pobee, Xiupei Mei, Wing Kwong Chan",,Main Track
1183,kbse/ase,2019,Wuji: Automatic Online Combat Game Testing Using Evolutionary Deep Reinforcement Learning.,conf/kbse/ZhengFXS0HMLSC19,"Yan Zheng, Changjie Fan, Xiaofei Xie, Ting Su, Lei Ma, Jianye Hao, Zhaopeng Meng, Yang Liu, Ruimin Shen, Yingfeng Chen",,Main Track
1184,kbse/ase,2019,A Study of Oracle Approximations in Testing Deep Learning Libraries.,conf/kbse/NejadgholiY19,"Mahdi Nejadgholi, Jinqiu Yang",,Main Track
1185,kbse/ase,2019,Property Inference for Deep Neural Networks.,conf/kbse/GopinathCPT19,"Divya Gopinath, Hayes Converse, Corina S. Pasareanu, Ankur Taly",,Main Track
1186,kbse/ase,2019,An Empirical Study Towards Characterizing Deep Learning Development and Deployment Across Different Frameworks and Platforms.,conf/kbse/GuoCXMHLLZL19,"Qianyu Guo, Sen Chen, Xiaofei Xie, Lei Ma, Qiang Hu, Hongtao Liu, Yang Liu, Jianjun Zhao, Xiaohong Li",,Main Track
1187,kbse/ase,2019,RefBot: Intelligent Software Refactoring Bot.,conf/kbse/AlizadehOKC19,"Vahid Alizadeh, Mohamed Amine Ouali, Marouane Kessentini, Meriem Chater",,Main Track
1188,kbse/ase,2019,Automated Refactoring to Reactive Programming.,conf/kbse/KohlerS19,"Mirko Köhler, Guido Salvaneschi",,Main Track
1189,kbse/ase,2019,Empirical Study of Programming to an Interface.,conf/kbse/VerhaegheFGAD19,"Benoît Verhaeghe, Christopher Fuhrman, Latifa Guerrouj, Nicolas Anquetil, Stéphane Ducasse",,Main Track
1190,kbse/ase,2019,Statistical Log Differencing.,conf/kbse/BaoB0M19,"Lingfeng Bao, Nimrod Busany, David Lo, Shahar Maoz",,Main Track
1191,kbse/ase,2019,Logzip: Extracting Hidden Structures via Iterative Clustering for Log Compression.,conf/kbse/LiuZHHZL19,"Jinyang Liu, Jieming Zhu, Shilin He, Pinjia He, Zibin Zheng, Michael R. Lyu",,Main Track
1192,kbse/ase,2019,Code-First Model-Driven Engineering: On the Agile Adoption of MDE Tooling.,conf/kbse/Boronat19,Artur Boronat,,Main Track
1193,kbse/ase,2019,Size and Accuracy in Model Inference.,conf/kbse/BusanyMY19,"Nimrod Busany, Shahar Maoz, Yehonatan Yulazari",,Main Track
1194,kbse/ase,2019,Debreach: Mitigating Compression Side Channels via Static Analysis and Transformation.,conf/kbse/PaulsenSPW19,"Brandon Paulsen, Chungha Sung, Peter A. H. Peterson, Chao Wang",,Main Track
1195,kbse/ase,2019,Fine-Grain Memory Object Representation in Symbolic Execution.,conf/kbse/Nowack19,Martin Nowack,,Main Track
1196,kbse/ase,2019,RENN: Efficient Reverse Execution with Neural-Network-Assisted Alias Analysis.,conf/kbse/MuGCCGXMS19,"Dongliang Mu, Wenbo Guo, Alejandro Cuevas, Yueqi Chen, Jinxuan Gai, Xinyu Xing, Bing Mao, Chengyu Song",,Main Track
1197,kbse/ase,2019,Batch Alias Analysis.,conf/kbse/VeduradaN19,"Jyothi Vedurada, V. Krishna Nandivada",,Main Track
1198,kbse/ase,2019,Improving the Decision-Making Process of Self-Adaptive Systems by Accounting for Tactic Volatility.,conf/kbse/PalmerinoYDK19,"Jeffrey Palmerino, Qi Yu, Travis Desell, Daniel E. Krutz",,Main Track
1199,kbse/ase,2019,Learning-Guided Network Fuzzing for Testing Cyber-Physical System Defences.,conf/kbse/0001P0A019,"Yuqi Chen, Christopher M. Poskitt, Jun Sun, Sridhar Adepu, Fan Zhang",,Main Track
1200,kbse/ase,2019,Cautious Adaptation of Defiant Components.,conf/kbse/MaiaVCYZN19,"Paulo Henrique M. Maia, Lucas Vieira, Matheus Chagas, Yijun Yu, Andrea Zisman, Bashar Nuseibeh",,Main Track
1201,kbse/ase,2019,Active Hotspot: An Issue-Oriented Model to Monitor Software Evolution and Degradation.,conf/kbse/FengCKC0F19,"Qiong Feng, Yuanfang Cai, Rick Kazman, Di Cui, Ting Liu, Hongzhou Fang",,Main Track
1202,kbse/ase,2019,Automated Trainability Evaluation for Smart Software Functions.,conf/kbse/Gerostathopoulos19,"Ilias Gerostathopoulos, Stefan Kugele, Christoph Segler, Tomás Bures, Alois Knoll",,Main Track
1203,kbse/ase,2019,The Impact of Structure on Software Merging: Semistructured Versus Structured Merge.,conf/kbse/CavalcantiBSA19,"Guilherme Cavalcanti, Paulo Borba, Georg Seibt, Sven Apel",,Main Track
1204,kbse/ase,2019,Semistructured Merge in JavaScript Systems.,conf/kbse/TavaresBCS19,"Alberto Trindade Tavares, Paulo Borba, Guilherme Cavalcanti, Sérgio Soares",,Main Track
1205,kbse/ase,2019,CLCDSA: Cross Language Code Clone Detection using Syntactical Features and API Documentation.,conf/kbse/NafiKRRS19,"Kawser Wazed Nafi, Tonny Shekha Kar, Banani Roy, Chanchal K. Roy, Kevin A. Schneider",,Main Track
1206,kbse/ase,2019,B2SFinder: Detecting Open-Source Software Reuse in COTS Software.,conf/kbse/FengYLBWTSYXPXH19,"Muyue Feng, Zimu Yuan, Feng Li, Gu Ban, Shiyang Wang, Qian Tang, He Su, Chendong Yu, Jiahuan Xu, Aihua Piao, Jingling Xue, Wei Huo",,Main Track
1207,kbse/ase,2019,CoRA: Decomposing and Describing Tangled Code Changes for Reviewer.,conf/kbse/WangLZX19,"Min Wang, Zeqi Lin, Yanzhen Zou, Bing Xie",,Main Track
1208,kbse/ase,2019,A Quantitative Analysis Framework for Recurrent Neural Network.,conf/kbse/DuX000Z19,"Xiaoning Du, Xiaofei Xie, Yi Li, Lei Ma, Yang Liu, Jianjun Zhao",Tool,Tool Demonstrations
1209,kbse/ase,2019,LIRAT: Layout and Image Recognition Driving Automated Mobile Testing of Cross-Platform.,conf/kbse/YuF0Z019,"Shengcheng Yu, Chunrong Fang, Yang Feng, Wenyuan Zhao, Zhenyu Chen",Tool,Tool Demonstrations
