,conference,year,title,id,authors,tags,notes
255,icse/icse,2019,Distilling neural representations of data structure manipulation using fMRI and fNIRS.,conf/icse/HuangLKSHLW19,"Yu Huang, Xinyu Liu, Ryan Krueger, Tyler Santander, Xiaosu Hu, Kevin Leach, Westley Weimer",Studying developers,
256,icse/icse,2019,FastLane: test minimization for rapidly deployed large-scale online services.,conf/icse/PhilipBKMN19,"Adithya Abraham Philip, Ranjita Bhagwan, Rahul Kumar, Chandra Shekhar Maddila, Nachiappan Nagappan",Test selection and prioritization,
257,icse/icse,2019,Scalable approaches for test suite reduction.,conf/icse/CrucianiMVB19,"Emilio Cruciani, Breno Miranda, Roberto Verdecchia, Antonia Bertolino",Test selection and prioritization,
258,icse/icse,2019,A framework for checking regression test selection tools.,conf/icse/ZhuLSG19,"Chenguang Zhu, Owolabi Legunsen, August Shi, Milos Gligoric",Test selection and prioritization,
259,icse/icse,2019,Supporting analysts by dynamic extraction and classification of requirements-related knowledge.,conf/icse/AbadGZF19,"Zahra Shakeri Hossein Abad, Vincenzo Gervasi, Didar Zowghi, Behrouz H. Far",Requirements,
260,icse/icse,2019,Analysis and detection of information types of open source software issue discussions.,conf/icse/AryaWGC19,"Deeksha Arya, Wenting Wang, Jin L. C. Guo, Jinghui Cheng",Software analytics,
261,icse/icse,2019,Do developers discover new tools on the toilet?,conf/icse/Murphy-HillSSJW19,"Emerson R. Murphy-Hill, Edward K. Smith, Caitlin Sadowski, Ciera Jaspan, Collin Winter, Matthew Jorde, Andrea Knight, Andrew Trenk, Steve Gross",Tool taxonomy and adoption,
262,icse/icse,2019,Tool choice matters: JavaScript quality assurance tools and usage outcomes in GitHub projects.,conf/icse/KavalerTVF19,"David Kavaler, Asher Trockman, Bogdan Vasilescu, Vladimir Filkov",Tool taxonomy and adoption,
263,icse/icse,2019,Hunting for bugs in code coverage tools via randomized differential testing.,conf/icse/YangZSS00X19,"Yibiao Yang, Yuming Zhou, Hao Sun, Zhendong Su, Zhiqiang Zuo, Lei Xu, Baowen Xu",Unit testing,
264,icse/icse,2019,Rotten green tests.,conf/icse/DelplanqueDPBE19,"Julien Delplanque, Stéphane Ducasse, Guillermo Polito, Andrew P. Black, Anne Etien",Unit testing,
265,icse/icse,2019,VFix: value-flow-guided precise program repair for null pointer dereferences.,conf/icse/XuSYX19,"Xuezheng Xu, Yulei Sui, Hua Yan, Jingling Xue",Automated repair,
266,icse/icse,2019,On reliability of patch correctness assessment.,conf/icse/LeB00LP19,"Xuan-Bach D. Le, Lingfeng Bao, David Lo, Xin Xia, Shanping Li, Corina S. Pasareanu",Automated repair,
267,icse/icse,2019,How reliable is the crowdsourced knowledge of security implementation?,conf/icse/ChenFMWG19,"Mengsu Chen, Felix Fischer, Na Meng, Xiaoyin Wang, Jens Grossklags",Crowdsourced knowledge and feedback,
268,icse/icse,2019,Pattern-based mining of opinions in Q&A websites.,conf/icse/0008ZBPL19,"Bin Lin, Fiorella Zampetti, Gabriele Bavota, Massimiliano Di Penta, Michele Lanza",Crowdsourced knowledge and feedback,
269,icse/icse,2019,Detection and repair of architectural inconsistencies in Java.,conf/icse/GhorbaniGM19,"Negar Ghorbani, Joshua Garcia, Sam Malek",Dependencies,
270,icse/icse,2019,Could I have a stack trace to examine the dependency conflict issue?,conf/icse/WangWWLTZYC19,"Ying Wang, Ming Wen, Rongxin Wu, Zhenwei Liu, Shin Hwei Tan, Zhiliang Zhu, Hai Yu, Shing-Chi Cheung",Dependencies,
271,icse/icse,2019,Investigating the impact of multiple dependency structures on software defects.,conf/icse/CuiLCZFJGQ19,"Di Cui, Ting Liu, Yuanfang Cai, Qinghua Zheng, Qiong Feng, Wuxia Jin, Jiaqi Guo, Yu Qu",Dependencies,
272,icse/icse,2019,StoryDroid: automated generation of storyboard for Android apps.,conf/icse/ChenFCSLLX19,"Sen Chen, Lingling Fan, Chunyang Chen, Ting Su, Wenhe Li, Yang Liu, Lihua Xu",Requirements engineering for mass-market software,
273,icse/icse,2019,Statistical algorithmic profiling for randomized approximate programs.,conf/icse/JoshiFM19,"Keyur Joshi, Vimuth Fernando, Sasa Misailovic",Trends and challenges in SE,
274,icse/icse,2019,Safe automated refactoring for intelligent parallelization of Java 8 streams.,conf/icse/KhatchadourianT19,"Raffi Khatchadourian, Yiming Tang, Mehdi Bagherzadeh, Syed Ahmed",Concurrency,
275,icse/icse,2019,Detecting atomicity violations for event-driven Node.js applications.,conf/icse/ChangDGW0H19,"Xiaoning Chang, Wensheng Dou, Yu Gao, Jie Wang, Jun Wei, Tao Huang",Concurrency,
276,icse/icse,2019,Parallel refinement for multi-threaded program verification.,conf/icse/Yin0L019,"Liangze Yin, Wei Dong, Wanwei Liu, Ji Wang",Concurrency,
277,icse/icse,2019,Mining software defects: should we consider affected releases?,conf/icse/YatishJTT19,"Suraj Yatish, Jirayus Jiarpakdee, Patanamon Thongtanunam, Chakkrit Tantithamthavorn",Defect prediction,
278,icse/icse,2019,Class imbalance evolution and verification latency in just-in-time software defect prediction.,conf/icse/CabralMSM19,"George G. Cabral, Leandro L. Minku, Emad Shihab, Suhaib Mujahid",Defect prediction,
279,icse/icse,2019,FLOSS participants' perceptions about gender and inclusiveness: a survey.,conf/icse/LeeC19,"Amanda Lee, Jeffrey C. Carver",Developer biases and trust,
280,icse/icse,2019,Going farther together: the impact of social capital on sustained participation in open source.,conf/icse/QiuNBSV19,"Huilian Sophie Qiu, Alexander Nolte, Anita Brown, Alexander Serebrenik, Bogdan Vasilescu",Developer biases and trust,
281,icse/icse,2019,Investigating the effects of gender bias on GitHub.,conf/icse/ImtiazMCRBM19,"Nasif Imtiaz, Justin Middleton, Joymallya Chakraborty, Neill Robson, Gina Bai, Emerson R. Murphy-Hill",Developer biases and trust,
282,icse/icse,2019,SLF: fuzzing without valid seed inputs.,conf/icse/YouLMPZ019,"Wei You, Xuwei Liu, Shiqing Ma, David Mitchel Perry, Xiangyu Zhang, Bin Liang",Fuzzing,
283,icse/icse,2019,Superion: grammar-aware greybox fuzzing.,conf/icse/Wang0WL19,"Junjie Wang, Bihuan Chen, Lei Wei, Yang Liu",Fuzzing,
284,icse/icse,2019,Grey-box concolic testing on binary code.,conf/icse/0002JHC19,"Jaeseung Choi, Joonun Jang, Choongwoo Han, Sang Kil Cha",Fuzzing,
285,icse/icse,2019,RESTler: stateful REST API fuzzing.,conf/icse/AtlidakisGP19,"Vaggelis Atlidakis, Patrice Godefroid, Marina Polishchuk",Fuzzing,
286,icse/icse,2019,Training binary classifiers as data structure invariants.,conf/icse/MolinaDPRAF19,"Facundo Molina, Renzo Degiovanni, Pablo Ponzio, Germán Regis, Nazareno Aguirre, Marcelo F. Frias",Machine learning in static analysis,
287,icse/icse,2019,Graph embedding based familial analysis of Android malware using unsupervised learning.,conf/icse/FanLLWNZL19,"Ming Fan, Xiapu Luo, Jun Liu, Meng Wang, Chunyin Nong, Qinghua Zheng, Ting Liu",Machine learning in static analysis,
288,icse/icse,2019,A novel neural source code representation based on abstract syntax tree.,conf/icse/ZhangWZ0WL19,"Jian Zhang, Xu Wang, Hongyu Zhang, Hailong Sun, Kaixuan Wang, Xudong Liu",Machine learning in static analysis,
289,icse/icse,2019,A neural model for generating natural language summaries of program subroutines.,conf/icse/LeClairJM19,"Alexander LeClair, Siyuan Jiang, Collin McMillan",Machine learning in static analysis,
290,icse/icse,2019,The list is the process: reliable pre-integration tracking of commits on mailing lists.,conf/icse/RamsauerLM19,"Ralf Ramsauer, Daniel Lohmann, Wolfgang Mauerer",Mining software changes and patterns,
291,icse/icse,2019,"Graph-based mining of in-the-wild, fine-grained, semantic code change patterns.",conf/icse/NguyenNDNTH19,"Hoan Anh Nguyen, Tien N. Nguyen, Danny Dig, Son Nguyen, Hieu Tran, Michael Hilton",Mining software changes and patterns,
292,icse/icse,2019,Intention-based integration of software variants.,conf/icse/LillackSHBW19,"Max Lillack, Stefan Stanciulescu, Wilhelm Hedman, Thorsten Berger, Andrzej Wasowski",Software product lines,
293,icse/icse,2019,Supporting the statistical analysis of variability models.,conf/icse/HeradioFME19,"Ruben Heradio, David Fernández-Amorós, Christoph Mayr-Dorn, Alexander Egyed",Software product lines,
294,icse/icse,2019,Multifaceted automated analyses for variability-intensive embedded systems.,conf/icse/LazregCCH019,"Sami Lazreg, Maxime Cordy, Philippe Collet, Patrick Heymans, Sébastien Mosser",Software product lines,
295,icse/icse,2019,Exposing library API misuses via mutation analysis.,conf/icse/WenLWXCS19,"Ming Wen, Yepang Liu, Rongxin Wu, Xuan Xie, Shing-Chi Cheung, Zhendong Su",API analysis,
296,icse/icse,2019,Pivot: learning API-device correlations to facilitate Android compatibility issue detection.,conf/icse/WeiLC19,"Lili Wei, Yepang Liu, Shing-Chi Cheung",API analysis,
297,icse/icse,2019,SafeCheck: safety enhancement of Java unsafe API.,conf/icse/HuangGLLQC019,"Shiyou Huang, Jianmei Guo, Sanhong Li, Xiang Li, Yumin Qi, Kingsum Chow, Jeff Huang",API analysis,
298,icse/icse,2019,CTRAS: crowdsourced test report aggregation and summarization.,conf/icse/HaoFJL019,"Rui Hao, Yang Feng, James A. Jones, Yuying Li, Zhenyu Chen",Crowdsourcing in software engineering,
299,icse/icse,2019,iSENSE: completion-aware crowdtesting management.,conf/icse/WangYKMW19,"Junjie Wang, Ye Yang, Rahul Krishna, Tim Menzies, Qing Wang",Crowdsourcing in software engineering,
300,icse/icse,2019,How practitioners perceive coding proficiency.,conf/icse/0001WK019,"Xin Xia, Zhiyuan Wan, Pavneet Singh Kochhar, David Lo",Human factors,
301,icse/icse,2019,Socio-technical work-rate increase associates with changes in work patterns in online projects.,conf/icse/SarkerVBF19,"Farhana Sarker, Bogdan Vasilescu, Kelly Blincoe, Vladimir Filkov",Human factors,
302,icse/icse,2019,Why do episodic volunteers stay in FLOSS communities?,conf/icse/BarcombSR019,"Ann Barcomb, Klaas-Jan Stol, Dirk Riehle, Brian Fitzgerald",Human factors,
303,icse/icse,2019,When code completion fails: a case study on real-world completions.,conf/icse/HellendoornPGB19,"Vincent J. Hellendoorn, Sebastian Proksch, Harald C. Gall, Alberto Bacchelli",IDEs,
304,icse/icse,2019,Interactive production performance feedback in the IDE.,conf/icse/CitoLRG19,"Jürgen Cito, Philipp Leitner, Martin Rinard, Harald C. Gall",IDEs,
305,icse/icse,2019,Redundant loads: a software inefficiency indicator.,conf/icse/SuWYC019,"Pengfei Su, Shasha Wen, Hailong Yang, Milind Chabbi, Xu Liu",Performance,
306,icse/icse,2019,View-centric performance optimization for database-backed web applications.,conf/icse/YangYWLC19,"Junwen Yang, Cong Yan, Chengcheng Wan, Shan Lu, Alvin Cheung",Performance,
307,icse/icse,2019,Adjust: runtime mitigation of resource abusing third-party online ads.,conf/icse/WangKZ19,"Weihang Wang, I Luk Kim, Yunhui Zheng",Performance,
308,icse/icse,2019,Symbolic repairs for GR(1) specifications.,conf/icse/MaozRS19,"Shahar Maoz, Jan Oliver Ringert, Rafi Shalom",Specifications and models,
309,icse/icse,2019,CRADLE: cross-backend validation to detect and localize bugs in deep learning libraries.,conf/icse/PhamLQT19,"Hung Viet Pham, Thibaud Lutellier, Weizhen Qi, Lin Tan",Specifications and models,
310,icse/icse,2019,Guiding deep learning system testing using surprise adequacy.,conf/icse/KimFY19,"Jinhan Kim, Robert Feldt, Shin Yoo",Specifications and models,
311,icse/icse,2019,FOCUS: a recommender system for mining API function calls and usage patterns.,conf/icse/NguyenRRODP19,"Phuong T. Nguyen, Juri Di Rocco, Davide Di Ruscio, Lina Ochoa, Thomas Degueule, Massimiliano Di Penta",APIs,
312,icse/icse,2019,Test-driven code review: an empirical study.,conf/icse/SpadiniPBHBB19,"Davide Spadini, Fabio Palomba, Tobias Baum, Stefan Hanenberg, Magiel Bruntink, Alberto Bacchelli",Code reviews,
313,icse/icse,2019,Why does code review work for open source software communities?,conf/icse/AlamiCW19,"Adam Alami, Marisa Leavitt Cohn, Andrzej Wasowski",Code reviews,
314,icse/icse,2019,Distance-based sampling of software configuration spaces.,conf/icse/KalteneckerGSGA19,"Christian Kaltenecker, Alexander Grebhahn, Norbert Siegmund, Jianmei Guo, Sven Apel",Configuration and optimization,
315,icse/icse,2019,DeepPerf: performance prediction for configurable software with deep sparse neural network.,conf/icse/HaZ19,"Huong Ha, Hongyu Zhang",Configuration and optimization,
316,icse/icse,2019,GreenBundle: an empirical study on the energy impact of bundled processing.,conf/icse/ChowdhuryHKSMK19,"Shaiful Alam Chowdhury, Abram Hindle, Rick Kazman, Takumi Shuto, Ken Matsui, Yasutaka Kamei",Energy consumption in mobile apps,
317,icse/icse,2019,Search-based energy testing of Android.,conf/icse/JabbarvandLM19,"Reyhaneh Jabbarvand, Jun-Wei Lin, Sam Malek",Energy consumption in mobile apps,
318,icse/icse,2019,Global optimization of numerical programs via prioritized stochastic algebraic transformations.,conf/icse/WangWSTCS0WZL19,"Xie Wang, Huaijin Wang, Zhendong Su, Enyi Tang, Xin Chen, Weijun Shen, Zhenyu Chen, Linzhang Wang, Xianpei Zhang, Xuandong Li",Program transformations,
319,icse/icse,2019,Type migration in ultra-large-scale codebases.,conf/icse/Ketkar0MDA19,"Ameya Ketkar, Ali Mesbah, Davood Mazinanian, Danny Dig, Edward Aftandilian",Program transformations,
320,icse/icse,2019,Dynamic slicing for Android.,conf/icse/AzimAN019,"Tanzirul Azim, Arash Alavi, Iulian Neamtiu, Rajiv Gupta",Program transformations,
321,icse/icse,2019,Recovering variable names for minified code with usage contexts.,conf/icse/TranTNNN19,"Hieu Tran, Ngoc M. Tran, Son Nguyen, Hoan Nguyen, Tien N. Nguyen",Reverse engineering,
322,icse/icse,2019,"Gigahorse: thorough, declarative decompilation of smart contracts.",conf/icse/GrechBSS19,"Neville Grech, Lexi Brent, Bernhard Scholz, Yannis Smaragdakis",Reverse engineering,
323,icse/icse,2019,Probabilistic disassembly.,conf/icse/MillerKSZZL19,"Kenneth A. Miller, Yonghwi Kwon, Yi Sun, Zhuo Zhang, Xiangyu Zhang, Zhiqiang Lin",Reverse engineering,
324,icse/icse,2019,Software documentation issues unveiled.,conf/icse/AghajaniNVLMBL19,"Emad Aghajani, Csaba Nagy, Olga Lucero Vega-Márquez, Mario Linares-Vásquez, Laura Moreno, Gabriele Bavota, Michele Lanza",Software documentation,
325,icse/icse,2019,"9.6 million links in source code comments: purpose, evolution, and decay.",conf/icse/HataTKI19,"Hideaki Hata, Christoph Treude, Raula Gaikovina Kula, Takashi Ishio",Software documentation,
326,icse/icse,2019,Leveraging artifact trees to evolve and reuse safety cases.,conf/icse/AgrawalKVRCL19,"Ankit Agrawal, Seyedehzahra Khoshmanesh, Michael Vierhauser, Mona Rahimi, Jane Cleland-Huang, Robyn R. Lutz",Software quality,
327,icse/icse,2019,Detecting incorrect build rules.,conf/icse/LickerR19,"Nándor Licker, Andrew Rice","Testing and analysis:
domain-specific approaches",
328,icse/icse,2019,Adversarial sample detection for deep neural network through model mutation testing.,conf/icse/WangD00Z19,"Jingyi Wang, Guoliang Dong, Jun Sun, Xinyu Wang, Peixin Zhang","Testing and analysis:
domain-specific approaches",
329,icse/icse,2019,Deep differential testing of JVM implementations.,conf/icse/ChenSS19,"Yuting Chen, Ting Su, Zhendong Su","Testing and analysis:
domain-specific approaches",
330,icst/icst,2017,Localizing Faults in SQL Predicates.,conf/icst/GuoML17,"Yun Guo, Amihai Motro, Nan Li",Fault Localization and Injection,
331,icst/icst,2017,Prevalence of Single-Fault Fixes and Its Impact on Fault Localization.,conf/icst/PerezAd17,"Alexandre Perez, Rui Abreu, Marcelo d'Amorim",Fault Localization and Injection,
332,icst/icst,2017,FIFA: A Kernel-Level Fault Injection Framework for ARM-Based Embedded Linux System.,conf/icst/JeongLKKH17,"Eunjin Jeong, Namgoo Lee, Jinhan Kim, Duseok Kang, Soonhoi Ha",Fault Localization and Injection,
333,icst/icst,2017,Using Delta Debugging to Minimize Stress Tests for Concurrent Data Structures.,conf/icst/XuLC17,"Jing Xu, Yu Lei, Richard H. Carver","Debugging, Composite Faults, and Complexity Analysis",
334,icst/icst,2017,The Theory of Composite Faults.,conf/icst/GopinathJG17,"Rahul Gopinath, Carlos Jensen, Alex Groce","Debugging, Composite Faults, and Complexity Analysis",
335,icst/icst,2017,Symbolic Complexity Analysis Using Context-Preserving Histories.,conf/icst/LuckowKP17,"Kasper Søe Luckow, Rody Kersten, Corina S. Pasareanu","Debugging, Composite Faults, and Complexity Analysis",
336,icst/icst,2017,Coveringcerts: Combinatorial Methods for X.509 Certificate Testing.,conf/icst/KleineS17,"Kristoffer Kleine, Dimitris E. Simos",Security Testing,
337,icst/icst,2017,Recovering Semantic Traceability Links between APIs and Security Vulnerabilities: An Ontological Modeling Approach.,conf/icst/Al-QahtaniER17,"Sultan S. Al-Qahtani, Ellis E. Eghan, Juergen Rilling",Security Testing,
338,icst/icst,2017,Mining Sandboxes for Linux Containers.,conf/icst/WanLXCL17,"Zhiyuan Wan, David Lo, Xin Xia, Liang Cai, Shanping Li",Security Testing,
339,icst/icst,2017,Perphecy: Performance Regression Test Selection Made Simple but Effective.,conf/icst/OliveiraFDHS17,"Augusto Born de Oliveira, Sebastian Fischmeister, Amer Diwan, Matthias Hauswirth, Peter F. Sweeney",Regression Testing,
340,icst/icst,2017,A Selection Method for Black Box Regression Testing with a Statistically Defined Quality Level.,conf/icst/AlagozHG17,"Ibrahim Alagöz, Thomas Herpel, Reinhard German",Regression Testing,
341,icst/icst,2017,Private API Access and Functional Mocking in Automated Unit Test Generation.,conf/icst/ArcuriFJ17,"Andrea Arcuri, Gordon Fraser, René Just",Regression Testing,
342,icst/icst,2017,Using Semantic Similarity in Crawling-Based Web Application Testing.,conf/icst/LinWC17,"Jun-Wei Lin, Farn Wang, Paul Chu",Web and Mobile Applications,
343,icst/icst,2017,"Barista: A Technique for Recording, Encoding, and Running Platform Independent Android Tests.",conf/icst/FazziniFCO17,"Mattia Fazzini, Eduardo Noronha de A. Freitas, Shauvik Roy Choudhary, Alessandro Orso",Web and Mobile Applications,
344,icst/icst,2017,ATOM: Automatic Maintenance of GUI Test Scripts for Evolving Mobile Applications.,conf/icst/LiCWH0WL17,"Xiao Li, Nana Chang, Yan Wang, Haohua Huang, Yu Pei, Linzhang Wang, Xuandong Li",Web and Mobile Applications,
345,icst/icst,2017,Automated Testing of Definition-Use Data Flow for Multithreaded Programs.,conf/icst/ZhangYZLCHL17,"Xiaodong Zhang, Zijiang Yang, Qinghua Zheng, Pei Liu, Jialiang Chang, Yu Hao, Ting Liu",Parallel Systems and Concurrency,
346,icst/icst,2017,IPA: Error Propagation Analysis of Multi-Threaded Programs Using Likely Invariants.,conf/icst/ChanWSPS17,"Abraham Chan, Stefan Winter, Habib Saissi, Karthik Pattabiraman, Neeraj Suri",Parallel Systems and Concurrency,
347,icst/icst,2017,Verifying Concurrent Programs Using Contracts.,conf/icst/DiasFFLSSV17,"Ricardo J. Dias, Carla Ferreira, Jan Fiedor, João M. Lourenço, Ales Smrcka, Diogo G. Sousa, Tomás Vojnar",Parallel Systems and Concurrency,
348,icst/icst,2017,Are There Any Unit Tests? An Empirical Study on Unit Testing in Open Source Python Projects.,conf/icst/TrautschG17,"Fabian Trautsch, Jens Grabowski",Empirics on Testing,
349,icst/icst,2017,Broadcast vs. Unicast Review Technology: Does It Matter?,conf/icst/ArmstrongKA17,"Foundjem Armstrong, Foutse Khomh, Bram Adams",Empirics on Testing,
350,icst/icst,2017,JavaScript: The (Un)Covered Parts.,conf/icst/Fard017,"Amin Milani Fard, Ali Mesbah",Empirics on Testing,
351,icst/icst,2017,Non-Semantics-Preserving Transformations for Higher-Coverage Test Generation Using Symbolic Execution.,conf/icst/ConverseOK17,"Hayes Converse, Oswaldo Olivo, Sarfraz Khurshid",Model-Based Testing,
352,icst/icst,2017,Uncertainty-Driven Black-Box Test Data Generation.,conf/icst/WalkinshawF17,"Neil Walkinshaw, Gordon Fraser",Model-Based Testing,
353,icst/icst,2017,Automated Test Generation and Mutation Testing for Alloy.,conf/icst/SullivanWZK17,"Allison Sullivan, Kaiyuan Wang, Razieh Nokhbeh Zaeem, Sarfraz Khurshid",Model-Based Testing,
354,icst/icst,2017,Model-Based Testing IoT Communication via Active Automata Learning.,conf/icst/TapplerAB17,"Martin Tappler, Bernhard K. Aichernig, Roderick Bloem",Model-Based Testing,
355,icst/icst,2017,Model-Based API Testing of Apache ZooKeeper.,conf/icst/ArthoGRBMKHTY17,"Cyrille Artho, Quentin Gros, Guillaume Rousset, Kazuaki Banzai, Lei Ma, Takashi Kitamura, Masami Hagiya, Yoshinori Tanabe, Mitsuharu Yamamoto",Model-Based Testing,
356,icst/icst,2017,System Testing of Timing Requirements Based on Use Cases and Timed Automata.,conf/icst/WangPB17,"Chunhui Wang, Fabrizio Pastore, Lionel C. Briand",Model-Based Testing,
357,icst/icst,2017,Efficient Incrementalized Runtime Checking of Linear Measures on Lists.,conf/icst/Gyori0PM17,"Alex Gyori, Pranav Garg, Edgar Pek, P. Madhusudan",Automated and Run-Time Testing,
358,icst/icst,2017,Behavioral Execution Comparison: Are Tests Representative of Field Behavior?,conf/icst/WangBO17,"Qianqian Wang, Yuriy Brun, Alessandro Orso",Automated and Run-Time Testing,
359,icst/icst,2017,Automated Random Testing in Multiple Dispatch Languages.,conf/icst/PouldingF17a,"Simon M. Poulding, Robert Feldt",Automated and Run-Time Testing,
360,icst/icst,2017,The Fitness Function for the Job: Search-Based Generation of Test Suites That Detect Real Faults.,conf/icst/Gay17,Gregory Gay,Search-Based Testing,
361,icst/icst,2017,A Search-Based Testing Approach for XML Injection Vulnerabilities in Web Applications.,conf/icst/JanNAB17,"Sadeeq Jan, Cu D. Nguyen, Andrea Arcuri, Lionel C. Briand",Search-Based Testing,
362,icst/icst,2017,CBGA-ES: A Cluster-Based Genetic Algorithm with Elitist Selection for Supporting Multi-Objective Test Optimization.,conf/icst/PradhanWAYL17,"Dipesh Pradhan, Shuai Wang, Shaukat Ali, Tao Yue, Marius Liaaen",Search-Based Testing,
363,icst/icst,2017,Incremental Deductive Verification for Relational Model Transformations.,conf/icst/ChengT17,"Zheng Cheng, Massimo Tisi",Model Checking and Verification,
364,icst/icst,2017,Statistical Model Checking Meets Property-Based Testing.,conf/icst/AichernigS17,"Bernhard K. Aichernig, Richard Schumi",Model Checking and Verification,
365,icst/icst,2017,Timed k-Tail: Automatic Inference of Timed Automata.,conf/icst/PastoreMM17,"Fabrizio Pastore, Daniela Micucci, Leonardo Mariani",Model Checking and Verification,
366,icst/icst,2017,A Comparative Study of Manual and Automated Testing for Industrial Control Software.,conf/icst/EnoiuSCP17,"Eduard Paul Enoiu, Daniel Sundmark, Adnan Causevic, Paul Pettersson",New Methods and Empirical Results,(Short Papers)
367,icst/icst,2017,How Do Assertions Impact Coverage-Based Test-Suite Reduction?,conf/icst/ChenBHZZX17,"Junjie Chen, Yanwei Bai, Dan Hao, Lingming Zhang, Lu Zhang, Bing Xie",New Methods and Empirical Results,(Short Papers)
368,icst/icst,2017,Automata Language Equivalence vs. Simulations for Model-Based Mutant Equivalence: An Empirical Evaluation.,conf/icst/DevroeyPPLSH17,"Xavier Devroey, Gilles Perrouin, Mike Papadakis, Axel Legay, Pierre-Yves Schobbens, Patrick Heymans",New Methods and Empirical Results,(Short Papers)
369,icst/icst,2017,Assessing and Improving the Mutation Testing Practice of PIT.,conf/icst/LaurentPKHTV17,"Thomas Laurent, Mike Papadakis, Marinos Kintis, Christopher Henard, Yves Le Traon, Anthony Ventresque",New Methods and Empirical Results,(Short Papers)
370,icst/icst,2017,Generic and Effective Specification of Structural Test Objectives.,conf/icst/MarcozziDBKP17,"Michaël Marcozzi, Mickaël Delahaye, Sébastien Bardin, Nikolai Kosmatov, Virgile Prevosto",New Theories and Tools,(Short Papers)
371,icst/icst,2017,Ariadne: Hybridizing Directed Model Checking and Static Analysis.,conf/icst/MilewiczP17,"Reed Milewicz, Peter Pirkelbauer",New Theories and Tools,(Short Papers)
372,icst/icst,2017,A Toolkit for Testing Stochastic Simulations against Statistical Oracles.,conf/icst/PatrickDG17,"Matthew Patrick, Ruairi Donnelly, Christopher A. Gilligan",New Theories and Tools,(Short Papers)
373,icst/icst,2017,O!Snap: Cost-Efficient Testing in the Cloud.,conf/icst/GambiGZ17,"Alessio Gambi, Alessandra Gorla, Andreas Zeller",New Theories and Tools,(Short Papers)
374,icst/icst,2017,Accelerating Test Automation through a Domain Specific Language.,conf/icst/DwarakanathEPDP17,"Anurag Dwarakanath, Dipin Era, Aditya Priyadarshi, Neville Dubash, Sanjay Podder",Model Checking and DSL-Based Testing,
375,icst/icst,2017,Efficient Safety Proofs for Industry-Scale Code Using Abstractions and Bounded Model Checking.,conf/icst/DarkeCCV17,"Priyanka Darke, Bharti Chimdyalwar, Avriti Chauhan, R. Venkatesh",Model Checking and DSL-Based Testing,
376,icst/icst,2017,NuSeen: A Tool Framework for the NuSMV Model Checker.,conf/icst/ArcainiGR17a,"Paolo Arcaini, Angelo Gargantini, Elvinia Riccobene",Model Checking and DSL-Based Testing,
377,icst/icst,2017,Transferring State-of-the-Art Immutability Analyses: Experimentation Toolbox and Accuracy Benchmark.,conf/icst/HollandSK17,"Benjamin Holland, Ganesh Ram Santhanam, Suresh Kothari",Code Analysis and White Box Testing,
378,icst/icst,2017,NIVAnalyzer: A Tool for Automatically Detecting and Verifying Next-Intent Vulnerabilities in Android Apps.,conf/icst/TangCZGXHBM17,"Junjie Tang, Xingmin Cui, Ziming Zhao, Shanqing Guo, Xin-Shun Xu, Chengyu Hu, Tao Ban, Bing Mao",Code Analysis and White Box Testing,
379,icst/icst,2017,Taming Coverage Criteria Heterogeneity with LTest.,conf/icst/MarcozziBDKP17,"Michaël Marcozzi, Sébastien Bardin, Mickaël Delahaye, Nikolai Kosmatov, Virgile Prevosto",Code Analysis and White Box Testing,
380,icst/icst,2017,Test Design as Code: JCUnit.,conf/icst/UkaiQ17,"Hiroshi Ukai, Xiao Qu",Code Analysis and White Box Testing,
381,icst/icst,2017,SAGA Toolbox: Interactive Testing of Guarded Assertions.,conf/icst/FlemstromGK17,"Daniel Flemström, Thomas Gustafsson, Avenir Kobetski",Dynamic Analysis,
382,icst/icst,2017,TITAN: Test Suite Optimization for Highly Configurable Software.,conf/icst/MarijanLGSI17,"Dusica Marijan, Marius Liaaen, Arnaud Gotlieb, Sagar Sen, Carlo Ieva",Dynamic Analysis,
