,conference,year,title,id,authors,tags,notes
654,sigsoft/fse,2018,"Model transformation languages under a magnifying glass: a controlled experiment with Xtend, ATL, and QVT.",conf/sigsoft/HebigSBPW18,"Regina Hebig, Christoph Seidl, Thorsten Berger, John Kook Pedersen, Andrzej Wasowski",Models,
655,sigsoft/fse,2018,Applications of psychological science for actionable analytics.,conf/sigsoft/ChenFKM18,"Di Chen, Wei Fu, Rahul Krishna, Tim Menzies",Models,
656,sigsoft/fse,2018,A novel automated approach for software effort estimation based on data augmentation.,conf/sigsoft/SongM018,"Liyan Song, Leandro L. Minku, Xin Yao",Estimation and Prediction,
657,sigsoft/fse,2018,Predicting Node failure in cloud service systems.,conf/sigsoft/LinHDZSXLLWYCZ18,"Qingwei Lin, Ken Hsieh, Yingnong Dang, Hongyu Zhang, Kaixin Sui, Yong Xu, Jian-Guang Lou, Chenggang Li, Youjiang Wu, Randolph Yao, Murali Chintalapati, Dongmei Zhang",Estimation and Prediction,
658,sigsoft/fse,2018,Detecting speech act types in developer question/answer conversations during bug repair.,conf/sigsoft/WoodRAM18,"Andrew Wood, Paige Rodeghero, Ameer Armaly, Collin McMillan",Repair and Synthesis,
659,sigsoft/fse,2018,Visual web test repair.,conf/sigsoft/StoccoYM18,"Andrea Stocco, Rahulkrishna Yandrapally, Ali Mesbah",Repair and Synthesis,
660,sigsoft/fse,2018,Syntax-guided synthesis of Datalog programs.,conf/sigsoft/SiLZAKN18,"Xujie Si, Woosuk Lee, Richard Zhang, Aws Albarghouthi, Paraschos Koutris, Mayur Naik",Repair and Synthesis,
661,sigsoft/fse,2018,Large-scale study of substitutability in the presence of effects.,conf/sigsoft/MaddoxLR18,"Jackson Maddox, Yuheng Long, Hridesh Rajan",Software Maintenance,
662,sigsoft/fse,2018,An empirical study on crash recovery bugs in large-scale distributed systems.,conf/sigsoft/GaoDQGW0HZW18,"Yu Gao, Wensheng Dou, Feng Qin, Chushu Gao, Dong Wang, Jun Wei, Ruirui Huang, Li Zhou, Yongming Wu",Software Maintenance,
663,sigsoft/fse,2018,Complementing global and local contexts in representing API descriptions to improve API retrieval tasks.,conf/sigsoft/NguyenTPNT0NN18,"Thanh Van Nguyen, Ngoc M. Tran, Hung Phan, Trong Duc Nguyen, Linh H. Truong, Anh Tuan Nguyen, Hoan Anh Nguyen, Tien N. Nguyen",Software Maintenance,
664,sigsoft/fse,2018,Phys: probabilistic physical unit assignment and inconsistency detection.,conf/sigsoft/KateOZEX18,"Sayali Kate, John-Paul Ore, Xiangyu Zhang, Sebastian G. Elbaum, Zhaogui Xu",Probabilistic Reasoning,
665,sigsoft/fse,2018,Testing probabilistic programming systems.,conf/sigsoft/DuttaLHM18,"Saikat Dutta, Owolabi Legunsen, Zixin Huang, Sasa Misailovic",Probabilistic Reasoning,
666,sigsoft/fse,2018,Verifying the long-run behavior of probabilistic system models in the presence of uncertainty.,conf/sigsoft/LlerenaBBSR18,"Yamilet R. Serrano Llerena, Marcel Böhme, Marc Brünink, Guoxin Su, David S. Rosenblum",Probabilistic Reasoning,
667,sigsoft/fse,2018,Automated patch extraction via syntax- and semantics-aware Delta debugging on source code changes.,conf/sigsoft/HashimotoMI18,"Masatomo Hashimoto, Akira Mori, Tomonori Izumida",Debugging and Bug Localization,
668,sigsoft/fse,2018,Feedback-directed differential testing of interactive debuggers.,conf/sigsoft/LehmannP18,"Daniel Lehmann, Michael Pradel",Debugging and Bug Localization,
669,sigsoft/fse,2018,Improving IR-based bug localization with context-aware query reformulation.,conf/sigsoft/0001R18,"Mohammad Masudur Rahman, Chanchal K. Roy",Debugging and Bug Localization,
670,sigsoft/fse,2018,How should compilers explain problems to developers?,conf/sigsoft/BarikFMP18,"Titus Barik, Denae Ford, Emerson R. Murphy-Hill, Chris Parnin",Debugging and Bug Localization,
671,sigsoft/fse,2018,Ecosystem-level determinants of sustained activity in open-source projects: a case study of the PyPI ecosystem.,conf/sigsoft/ValievVH18,"Marat Valiev, Bogdan Vasilescu, James D. Herbsleb",Ecosystems and Crowdsourcing,
672,sigsoft/fse,2018,Optimizing test prioritization via test distribution analysis.,conf/sigsoft/ChenLZZWH018,"Junjie Chen, Yiling Lou, Lingming Zhang, Jianyi Zhou, Xiaoleng Wang, Dan Hao, Lu Zhang",Testing,
673,sigsoft/fse,2018,How well are regular expressions tested in the wild?,conf/sigsoft/WangS18,"Peipei Wang, Kathryn T. Stolee",Testing,
674,sigsoft/fse,2018,Which generated test failures are fault revealing? prioritizing failures based on inferred precondition violations using PAF.,conf/sigsoft/KimC018,"Mijung Kim, Shing-Chi Cheung, Sunghun Kim",Testing,
675,sigsoft/fse,2018,Detection of energy inefficiencies in Android wear watch faces.,conf/sigsoft/0006WR18,"Hailong Zhang, Haowei Wu, Atanas Rountev",Energy,
676,sigsoft/fse,2018,Stochastic energy optimization for mobile GPS applications.,conf/sigsoft/CaninoLM18,"Anthony Canino, Yu David Liu, Hidehiko Masuhara",Energy,
677,sigsoft/fse,2018,Gamifying static analysis.,conf/sigsoft/DoB18,"Lisa Nguyen Quang Do, Eric Bodden",NIER,
678,sigsoft/fse,2018,The case for experiment-oriented computing.,conf/sigsoft/Salem18,Paulo Salem,NIER,
679,sigsoft/fse,2018,On the naturalness of proofs.,conf/sigsoft/HellendoornDA18,"Vincent J. Hellendoorn, Premkumar T. Devanbu, Mohammad Amin Alipour",NIER,
680,sigsoft/fse,2018,Does ACM's code of ethics change ethical decision making in software development?,conf/sigsoft/McNamaraSM18,"Andrew McNamara, Justin Smith, Emerson R. Murphy-Hill",NIER,
681,sigsoft/fse,2018,How are spreadsheet templates used in practice: a case study on Enron.,conf/sigsoft/XuDZG0018,"Liang Xu, Wensheng Dou, Jiaxin Zhu, Chushu Gao, Jun Wei, Tao Huang",NIER,
682,sigsoft/fse,2018,DLFuzz: differential fuzzing testing of deep learning systems.,conf/sigsoft/GuoJZCS18,"Jianmin Guo, Yu Jiang, Yue Zhao, Quan Chen, Jiaguang Sun",NIER,
683,sigsoft/fse,2018,Towards data-driven vulnerability prediction for requirements.,conf/sigsoft/ImtiazB18,"Sayem Mohammad Imtiaz, Tanmay Bhowmik",NIER,
684,sigsoft/fse,2018,Beyond testing configurable systems: applying variational execution to automatic program repair and higher order mutation testing.,conf/sigsoft/WongMK18,"Chu-Pan Wong, Jens Meinicke, Christian Kästner",NIER,
685,sigsoft/fse,2018,Software fairness.,conf/sigsoft/BrunM18,"Yuriy Brun, Alexandra Meliou",NIER,
686,sigsoft/fse,2018,Software engineering collaboratories (SEClabs) and collaboratories as a service (CaaS).,conf/sigsoft/ShermanD18,"Elena Sherman, Robert Dyer",NIER,
687,sigsoft/fse,2018,Towards counterexample-guided k-induction for fast bug detection.,conf/sigsoft/GadelhaMCN18,"Mikhail Y. R. Gadelha, Felipe R. Monteiro, Lucas C. Cordeiro, Denis A. Nicole",NIER,
688,sigsoft/fse,2018,Salient-class location: help developers understand code change in code review.,conf/sigsoft/0002JCHZ18,"Yuan Huang, Nan Jia, Xiangping Chen, Kai Hong, Zibin Zheng",NIER,
689,sigsoft/fse,2018,Towards quantifying the development value of code contributions.,conf/sigsoft/RenYHFK18,"Jinglei Ren, Hezheng Yin, Qingda Hu, Armando Fox, Wojciech Koszek",NIER,
690,sigsoft/fse,2018,Operationalizing human values in software: a research roadmap.,conf/sigsoft/MougoueiPHSW18,"Davoud Mougouei, Harsha Perera, Waqar Hussain, Rifat Ara Shams, Jon Whittle",NIER,
691,sigsoft/fse,2018,Modeling and testing a family of surgical robots: an experience report.,conf/sigsoft/MansoorSSBCF18,"Niloofar Mansoor, Jonathan A. Saddler, Bruno Silva, Hamid Bagheri, Myra B. Cohen, Shane Farritor",Formal Analysis,
692,sigsoft/fse,2018,Efficient static checking of library updates.,conf/sigsoft/FooCYAS18,"Darius Foo, Hendy Chua, Jason Yeo, Ming Yi Ang, Asankhaya Sharma",Formal Analysis,
693,sigsoft/fse,2018,Are mobile banking apps secure? what can be improved?,conf/sigsoft/ChenSFMXLX18,"Sen Chen, Ting Su, Lingling Fan, Guozhu Meng, Minhui Xue, Yang Liu, Lihua Xu",Security,
694,sigsoft/fse,2018,VulSeeker-pro: enhanced semantic learning based binary vulnerability seeker with emulation.,conf/sigsoft/GaoYFJSS18,"Jian Gao, Xin Yang, Ying Fu, Yu Jiang, Heyuan Shi, Jiaguang Sun",Security,
695,sigsoft/fse,2018,PAFL: extend fuzzing optimizations of single mode to industrial parallel mode.,conf/sigsoft/LiangJCWZS18,"Jie Liang, Yu Jiang, Yuanliang Chen, Mingzhe Wang, Chijin Zhou, Jiaguang Sun",Security,
696,sigsoft/fse,2018,Software development challenges with air-gap isolation.,conf/sigsoft/WongW18,"Sunny Wong, Anne Woepse",Security,
697,sigsoft/fse,2018,Design and validation of precooked developer dashboards.,conf/sigsoft/IvanovPRSYZ18,"Vladimir Ivanov, Vladislav Pischulin, Alan Rogers, Giancarlo Succi, Jooyong Yi, Vasilii Zorin",End User Programming and Financial Applications,
698,sigsoft/fse,2018,Testing and validating end user programmed calculated fields.,conf/sigsoft/BrabermanGGUCPP18,"Víctor A. Braberman, Diego Garbervetsky, Javier Godoy, Sebastián Uchitel, Guido de Caso, Ignacio Perez, Santiago Perez",End User Programming and Financial Applications,
699,sigsoft/fse,2018,Automated refactoring of nested-IF formulae in spreadsheets.,conf/sigsoft/ZhangHHZZ18,"Jie Zhang, Shi Han, Dan Hao, Lu Zhang, Dongmei Zhang",End User Programming and Financial Applications,
700,sigsoft/fse,2018,FACTS: automated black-box testing of FinTech systems.,conf/sigsoft/WangGXXNDHX18,"Qingshun Wang, Lintao Gu, Minhui Xue, Lihua Xu, Wenyu Niu, Liang Dou, Liang He, Tao Xie",End User Programming and Financial Applications,
701,sigsoft/fse,2018,Regression test selection for TizenRT.,conf/sigsoft/CelikLG18,"Ahmet Çelik, Young-Chul Lee, Milos Gligoric",Test Automation,
702,sigsoft/fse,2018,Building lean continuous integration and delivery pipelines by applying DevOps principles: a case study at Varidesk.,conf/sigsoft/DebroyMB18,"Vidroha Debroy, Senecca Miller, Lance Brimble",Test Automation,
703,sigsoft/fse,2018,"The impact of failing, flaky, and high failure tests on the number of crash reports associated with Firefox builds.",conf/sigsoft/RahmanR18,"Md Tajmilur Rahman, Peter C. Rigby",Test Automation,
704,sigsoft/fse,2018,BigSift: automated debugging of big data analytics in data-intensive scalable computing.,conf/sigsoft/GulzarWK18,"Muhammad Ali Gulzar, Siman Wang, Miryung Kim",Testing,
705,sigsoft/fse,2018,"FOT: a versatile, configurable, extensible fuzzing framework.",conf/sigsoft/ChenLCXL18,"Hongxu Chen, Yuekang Li, Bihuan Chen, Yinxing Xue, Yang Liu",Testing,
706,sigsoft/fse,2018,Themis: automatically testing software for discrimination.,conf/sigsoft/AngellJBM18,"Rico Angell, Brittany Johnson, Yuriy Brun, Alexandra Meliou",Testing,
707,sigsoft/fse,2018,Vista: web test repair using computer vision.,conf/sigsoft/StoccoYM18a,"Andrea Stocco, Rahulkrishna Yandrapally, Ali Mesbah",Testing,
708,sigsoft/fse,2018,Augmenting stack overflow with API usage patterns mined from GitHub.,conf/sigsoft/Reinhardt0MK18,"Anastasia Reinhardt, Tianyi Zhang, Mihir Mathur, Miryung Kim",Bugs,
709,sigsoft/fse,2018,PowerStation: automatically detecting and fixing inefficiencies of database-backed web applications in IDE.,conf/sigsoft/YangYSLC18,"Junwen Yang, Cong Yan, Pranav Subramaniam, Shan Lu, Alvin Cheung",Bugs,
710,sigsoft/fse,2018,SketchFix: a tool for automated program repair approach using lazy candidate generation.,conf/sigsoft/HuaZWK18,"Jinru Hua, Mengshi Zhang, Kaiyuan Wang, Sarfraz Khurshid",Bugs,
711,sigsoft/fse,2018,WarningsGuru: integrating statistical bug models with static analysis to provide timely and specific bug warnings.,conf/sigsoft/QuerelR18,"Louis-Philippe Querel, Peter C. Rigby",Bugs,
712,sigsoft/fse,2018,DSM: a specification mining tool using recurrent neural network based language model.,conf/sigsoft/LeB018,"Tien-Duy B. Le, Lingfeng Bao, David Lo",Mining,
713,sigsoft/fse,2018,EClone: detect semantic clones in Ethereum via symbolic transaction sketch.,conf/sigsoft/LiuYLJZS18,"Han Liu, Zhiqiang Yang, Chao Liu, Yu Jiang, Wenqi Zhao, Jiaguang Sun",Mining,
714,sigsoft/fse,2018,INFAR: insight extraction from app reviews.,conf/sigsoft/GaoZ0LLK18,"Cuiyun Gao, Jichuan Zeng, David Lo, Chin-Yew Lin, Michael R. Lyu, Irwin King",Mining,
715,sigsoft/fse,2018,PyDriller: Python framework for mining software repositories.,conf/sigsoft/SpadiniAB18,"Davide Spadini, Maurício Finavaro Aniche, Alberto Bacchelli",Mining,
716,sigsoft/fse,2018,A formal verification tool for Ethereum VM bytecode.,conf/sigsoft/0001ZSDR18,"Daejun Park, Yi Zhang, Manasvi Saxena, Philip Daian, Grigore Rosu",Models,
717,sigsoft/fse,2018,ASketch: a sketching framework for Alloy.,conf/sigsoft/WangSMK18,"Kaiyuan Wang, Allison Sullivan, Darko Marinov, Sarfraz Khurshid",Models,
718,sigsoft/fse,2018,AlloyInEcore: embedding of first-order relational logic into meta-object facility for automated model reasoning.,conf/sigsoft/ErataGKT18,"Ferhat Erata, Arda Goknil, Ivan Kurtev, Bedir Tekinerdogan",Models,
719,sigsoft/fse,2018,VT-revolution: interactive programming tutorials made possible.,conf/sigsoft/BaoXX0L18,"Lingfeng Bao, Zhenchang Xing, Xin Xia, David Lo, Shanping Li",Models,
720,sigsoft/fse,2018,Practices and tools for better software testing.,conf/sigsoft/Spadini18,Davide Spadini,,Doctorial Symposium
721,sigsoft/fse,2018,Automated support for mobile application testing and maintenance.,conf/sigsoft/Fazzini18,Mattia Fazzini,,Doctorial Symposium
722,sigsoft/fse,2018,Moving towards objective measures of program comprehension.,conf/sigsoft/Fakhoury18,Sarah Fakhoury,,Doctorial Symposium
723,sigsoft/fse,2018,Semantic inference from natural language privacy policies and Android code.,conf/sigsoft/Hosseini18,Mitra Bokaei Hosseini,,Doctorial Symposium
724,sigsoft/fse,2018,Intelligent bug fixing with software bug knowledge graph.,conf/sigsoft/Zhou18,Cheng Zhou,,Doctorial Symposium
725,sigsoft/fse,2018,Quality assurance automation in autonomous systems.,conf/sigsoft/Afzal18,Afsoon Afzal,,Doctorial Symposium
726,sigsoft/fse,2018,"How do developers resolve merge conflicts? an investigation into the processes, tools, and improvements.",conf/sigsoft/Brindescu18,Caius Brindescu,,Doctorial Symposium
727,sigsoft/fse,2018,Automated scenario-based integration testing of distributed systems.,conf/sigsoft/Lima18,Bruno Lima,,Student Research Competition
728,sigsoft/fse,2018,Towards learning-augmented languages.,conf/sigsoft/Sun18,Xinyuan Sun,,Student Research Competition
729,sigsoft/fse,2018,On the adoption of neural networks in modeling software reliability.,conf/sigsoft/Gusmanov18,Kamill Gusmanov,,Student Research Competition
730,sigsoft/fse,2018,Type migration in large-scale code bases.,conf/sigsoft/Ketkar18,Ameya Ketkar,,Student Research Competition
731,sigsoft/fse,2018,Reshaping distributed agile and adaptive development environment.,conf/sigsoft/Nocera18,Francesco Nocera,,Student Research Competition
732,sigsoft/fse,2018,How Dance(Sport) can help to produce better software.,conf/sigsoft/Erofeeva18,Irina Erofeeva,,Student Research Competition
733,sigsoft/fse,2018,Feature-interaction aware configuration prioritization.,conf/sigsoft/Nguyen18,Son Nguyen,,Student Research Competition
734,sigsoft/fse,2018,Dara: hybrid model checking of distributed systems.,conf/sigsoft/Anand18,Vaastav Anand,,Student Research Competition
735,sigsoft/fse,2018,Bugs in the wild: examining the effectiveness of static analyzers at finding real-world bugs.,conf/sigsoft/Tomassi18,David A. Tomassi,,Student Research Competition
736,sigsoft/fse,2018,Mining error-handling specifications for systems software.,conf/sigsoft/DeFreez18,Daniel DeFreez,,Student Research Competition
737,sigsoft/fse,2018,Diversity and decorum in open source communities.,conf/sigsoft/Robson18,Neill Robson,,Student Research Competition
738,sigsoft/fse,2019,Living with feature interactions (keynote).,conf/sigsoft/Atlee19,Joanne M. Atlee,,Keynotes
739,sigsoft/fse,2019,Safety and robustness for deep learning with provable guarantees (keynote).,conf/sigsoft/Kwiatkowska19,Marta Kwiatkowska,,Keynotes
740,sigsoft/fse,2019,Insights from open source software supply chains (keynote).,conf/sigsoft/Mockus19,Audris Mockus,,Keynotes
741,sigsoft/fse,2019,Concolic testing for models of state-based systems.,conf/sigsoft/AhmadiD19,"Reza Ahmadi, Juergen Dingel",,Main Research
742,sigsoft/fse,2019,Target-driven compositional concolic testing with function summary refinement for effective bug detection.,conf/sigsoft/KimHK19,"Yunho Kim, Shin Hong, Moonzoo Kim",,Main Research
743,sigsoft/fse,2019,Generating automated and online test oracles for Simulink models with continuous and uncertain behaviors.,conf/sigsoft/MenghiNGB19,"Claudio Menghi, Shiva Nejati, Khouloud Gaaloul, Lionel C. Briand",,Main Research
744,sigsoft/fse,2019,Lifting Datalog-based analyses to software product lines.,conf/sigsoft/ShahinCS19,"Ramy Shahin, Marsha Chechik, Rick Salay",,Main Research
745,sigsoft/fse,2019,An empirical study of real-world variability bugs detected by variability-oblivious tools.,conf/sigsoft/MordahlOKWG19,"Austin Mordahl, Jeho Oh, Ugur Koc, Shiyi Wei, Paul Gazzillo",,Main Research
746,sigsoft/fse,2019,Principles of feature modeling.,conf/sigsoft/NesicKSB19,"Damir Nesic, Jacob Krüger, Stefan Stanciulescu, Thorsten Berger",,Main Research
747,sigsoft/fse,2019,Understanding GCC builtins to develop better tools.,conf/sigsoft/RiggerMAM19,"Manuel Rigger, Stefan Marr, Bram Adams, Hanspeter Mössenböck",,Main Research
748,sigsoft/fse,2019,Assessing the quality of the steps to reproduce in bug reports.,conf/sigsoft/ChaparroBLMMPPN19,"Oscar Chaparro, Carlos Bernal-Cárdenas, Jing Lu, Kevin Moran, Andrian Marcus, Massimiliano Di Penta, Denys Poshyvanyk, Vincent Ng",,Main Research
749,sigsoft/fse,2019,A learning-based approach for automatic construction of domain glossary from source code and documentation.,conf/sigsoft/Wang0LXBXW19,"Chong Wang, Xin Peng, Mingwei Liu, Zhenchang Xing, Xuefang Bai, Bing Xie, Tuo Wang",,Main Research
750,sigsoft/fse,2019,On using machine learning to identify knowledge in API reference documentation.,conf/sigsoft/FucciMM19,"Davide Fucci, Alireza Mollaalizadehbahnemiri, Walid Maalej",,Main Research
751,sigsoft/fse,2019,Generating query-specific class API summaries.,conf/sigsoft/Liu0MXXXL19,"Mingwei Liu, Xin Peng, Andrian Marcus, Zhenchang Xing, Wenkai Xie, Shuangshuang Xing, Yang Liu",,Main Research
752,sigsoft/fse,2019,Semantic relation based expansion of abbreviations.,conf/sigsoft/JiangLZ19,"Yanjie Jiang, Hui Liu, Lu Zhang",,Main Research
753,sigsoft/fse,2019,Diversity-based web test generation.,conf/sigsoft/Biagiola0RT19,"Matteo Biagiola, Andrea Stocco, Filippo Ricca, Paolo Tonella",,Main Research
754,sigsoft/fse,2019,Web test dependency detection.,conf/sigsoft/Biagiola00RT19,"Matteo Biagiola, Andrea Stocco, Ali Mesbah, Filippo Ricca, Paolo Tonella",,Main Research
755,sigsoft/fse,2019,Testing scratch programs automatically.,conf/sigsoft/StahlbauerKF19,"Andreas Stahlbauer, Marvin Kreis, Gordon Fraser",,Main Research
756,sigsoft/fse,2019,A large-scale empirical study of compiler errors in continuous integration.,conf/sigsoft/Zhang0C0Z19,"Chen Zhang, Bihuan Chen, Linlin Chen, Xin Peng, Wenyun Zhao",,Main Research
757,sigsoft/fse,2019,A statistics-based performance testing methodology for cloud applications.,conf/sigsoft/HeMS0PS19,"Sen He, Glenna Manns, John Saunders, Wei Wang, Lori L. Pollock, Mary Lou Soffa",,Main Research
758,sigsoft/fse,2019,How bad can a bug get? an empirical analysis of software failures in the OpenStack cloud computing platform.,conf/sigsoft/CotroneoSLNB19,"Domenico Cotroneo, Luigi De Simone, Pietro Liguori, Roberto Natella, Nematollah Bidokhti",,Main Research
759,sigsoft/fse,2019,Towards more efficient meta-heuristic algorithms for combinatorial test generation.,conf/sigsoft/LinCLLZ19,"Jinkun Lin, Shaowei Cai, Chuan Luo, Qingwei Lin, Hongyu Zhang",,Main Research
760,sigsoft/fse,2019,Compiler bug isolation via effective witness test program generation.,conf/sigsoft/0003HSZHZ19,"Junjie Chen, Jiaqi Han, Peiyi Sun, Lingming Zhang, Dan Hao, Lu Zhang",,Main Research
761,sigsoft/fse,2019,Concolic testing with adaptively changing search heuristics.,conf/sigsoft/ChaO19,"Sooyoung Cha, Hakjoo Oh",,Main Research
762,sigsoft/fse,2019,Symbolic execution-driven extraction of the parallel execution plans of Spark applications.,conf/sigsoft/BaresiDQ19,"Luciano Baresi, Giovanni Denaro, Giovanni Quattrocchi",,Main Research
763,sigsoft/fse,2019,Generating effective test cases for self-driving cars from police reports.,conf/sigsoft/GambiHF19,"Alessio Gambi, Tri Huynh, Gordon Fraser",,Main Research
764,sigsoft/fse,2019,Preference-wise testing for Android applications.,conf/sigsoft/LuPZ0L19,"Yifei Lu, Minxue Pan, Juan Zhai, Tian Zhang, Xuandong Li",,Main Research
765,sigsoft/fse,2019,Bisecting commits and modeling commit risk during testing.,conf/sigsoft/NajafiRS19,"Armin Najafi, Peter C. Rigby, Weiyi Shang",,Main Research
766,sigsoft/fse,2019,White-box testing of big data analytics with complex user-defined functions.,conf/sigsoft/GulzarMMK19,"Muhammad Ali Gulzar, Shaghayegh Mardani, Madanlal Musuvathi, Miryung Kim",,Main Research
767,sigsoft/fse,2019,"Empirical review of Java program repair tools: a large-scale experiment on 2, 141 bugs and 23, 551 repair attempts.",conf/sigsoft/DurieuxDMA19,"Thomas Durieux, Fernanda Madeiral, Matias Martinez, Rui Abreu",,Main Research
768,sigsoft/fse,2019,iFixR: bug report driven program repair.,conf/sigsoft/KoyuncuLB0MKT19,"Anil Koyuncu, Kui Liu, Tegawendé F. Bissyandé, Dongsun Kim, Martin Monperrus, Jacques Klein, Yves Le Traon",,Main Research
769,sigsoft/fse,2019,Exploring and exploiting the correlations between bug-inducing and bug-fixing commits.,conf/sigsoft/WenWLTXCS19,"Ming Wen, Rongxin Wu, Yepang Liu, Yongqiang Tian, Xuan Xie, Shing-Chi Cheung, Zhendong Su",,Main Research
770,sigsoft/fse,2019,Effects of explicit feature traceability on program comprehension.,conf/sigsoft/KrugerCBLS19,"Jacob Krüger, Gül Çalikli, Thorsten Berger, Thomas Leich, Gunter Saake",,Main Research
771,sigsoft/fse,2019,What the fork: a study of inefficient and efficient forking practices in social coding.,conf/sigsoft/ZhouVK19,"Shurui Zhou, Bogdan Vasilescu, Christian Kästner",,Main Research
772,sigsoft/fse,2019,ServDroid: detecting service usage inefficiencies in Android applications.,conf/sigsoft/SongZH19,"Wei Song, Jing Zhang, Jeff Huang",,Main Research
773,sigsoft/fse,2019,Together strong: cooperative Android app analysis.,conf/sigsoft/PauckW19,"Felix Pauck, Heike Wehrheim",,Main Research
774,sigsoft/fse,2019,A framework for writing trigger-action todo comments in executable format.,conf/sigsoft/NieRLKMG19,"Pengyu Nie, Rishabh Rai, Junyi Jessy Li, Sarfraz Khurshid, Raymond J. Mooney, Milos Gligoric",,Main Research
775,sigsoft/fse,2019,Decomposing the rationale of code commits: the software developer's perspective.,conf/sigsoft/SafwanS19,"Khadijah Al Safwan, Francisco Servant",,Main Research
776,sigsoft/fse,2019,Model-based testing of breaking changes in Node.js libraries.,conf/sigsoft/MollerT19,"Anders Møller, Martin Toldam Torp",,Main Research
777,sigsoft/fse,2019,Monitoring-aware IDEs.,conf/sigsoft/WinterACD19,"Jos Winter, Maurício Finavaro Aniche, Jürgen Cito, Arie van Deursen",,Main Research
778,sigsoft/fse,2019,Going big: a large-scale study on what big data developers ask.,conf/sigsoft/BagherzadehK19,"Mehdi Bagherzadeh, Raffi Khatchadourian",,Main Research
779,sigsoft/fse,2019,Why aren't regular expressions a lingua franca? an empirical study on the re-use and portability of regular expressions.,conf/sigsoft/DavisMCSL19,"James C. Davis, Louis G. Michael IV, Christy A. Coghlan, Francisco Servant, Dongyoon Lee",,Main Research
780,sigsoft/fse,2019,Nodest: feedback-driven static analysis of Node.js applications.,conf/sigsoft/NielsenHG19,"Benjamin Barslev Nielsen, Behnaz Hassanshahi, François Gauthier",,Main Research
781,sigsoft/fse,2019,Effective error-specification inference via domain-knowledge expansion.,conf/sigsoft/DeFreezBRT19,"Daniel DeFreez, Haaken Martinson Baldwin, Cindy Rubio-González, Aditya V. Thakur",,Main Research
782,sigsoft/fse,2019,DeepStellar: model-based quantitative analysis of stateful deep learning systems.,conf/sigsoft/DuXLM0Z19,"Xiaoning Du, Xiaofei Xie, Yi Li, Lei Ma, Yang Liu, Jianjun Zhao",,Main Research
783,sigsoft/fse,2019,REINAM: reinforcement learning for input-grammar inference.,conf/sigsoft/WuJYBSPX19,"Zhengkai Wu, Evan Johnson, Wei Yang, Osbert Bastani, Dawn Song, Jian Peng, Tao Xie",,Main Research
784,sigsoft/fse,2019,Boosting operational DNN testing efficiency through conditioning.,conf/sigsoft/LiM0CX019,"Zenan Li, Xiaoxing Ma, Chang Xu, Chun Cao, Jingwei Xu, Jian Lü",,Main Research
785,sigsoft/fse,2019,A comprehensive study on deep learning bug characteristics.,conf/sigsoft/IslamNPR19,"Md Johirul Islam, Giang Nguyen, Rangeet Pan, Hridesh Rajan",,Main Research
786,sigsoft/fse,2019,Just fuzz it: solving floating-point constraints using coverage-guided fuzzing.,conf/sigsoft/LiewCDS19,"Daniel Liew, Cristian Cadar, Alastair F. Donaldson, J. Ryan Stinnett",,Main Research
787,sigsoft/fse,2019,Cerebro: context-aware adaptive fuzzing for effective vulnerability detection.,conf/sigsoft/LiXCWZXWL19,"Yuekang Li, Yinxing Xue, Hongxu Chen, Xiuheng Wu, Cen Zhang, Xiaofei Xie, Haijun Wang, Yang Liu",,Main Research
788,sigsoft/fse,2019,iFixFlakies: a framework for automatically fixing order-dependent flaky tests.,conf/sigsoft/ShiLO0M19,"August Shi, Wing Lam, Reed Oei, Tao Xie, Darko Marinov",,Main Research
789,sigsoft/fse,2019,Binary reduction of dependency graphs.,conf/sigsoft/KalhaugeP19,"Christian Gram Kalhauge, Jens Palsberg",,Main Research
790,sigsoft/fse,2019,AggrePlay: efficient record and replay of multi-threaded programs.,conf/sigsoft/PobeeC19,"Ernest Bota Pobee, Wing Kwong Chan",,Main Research
791,sigsoft/fse,2019,The review linkage graph for code review analytics: a recovery approach and empirical study.,conf/sigsoft/HiraoMIM19,"Toshiki Hirao, Shane McIntosh, Akinori Ihara, Kenichi Matsumoto",,Main Research
792,sigsoft/fse,2019,Mitigating power side channels during compilation.,conf/sigsoft/WangSW19,"Jingbo Wang, Chungha Sung, Chao Wang",,Main Research
