,Id,Conf,Year,Title,Authors,Abstract,ml_score
473,conf/icst/KahlesTHJ19,icst/icst,2019,Automating Root Cause Analysis via Machine Learning in Agile Software Testing Environments.,"Julen Kahles,Juha Torronen,Timo Huuhtanen,Alexander Jung","We apply machine learning to automate the root cause analysis in agile software testing environments. In particular, we extract relevant features from raw log data after interviewing testing engineers (human experts). Initial efforts are put into clustering the unlabeled data, and despite obtaining weak correlations between several clusters and failure root causes, the vagueness in the rest of the clusters leads to the consideration of labeling. A new round of interviews with the testing engineers leads to the definition of five ground-truth categories. Using manually labeled data, we train artificial neural networks that either classify the data or pre-process it for clustering. The resulting method achieves an accuracy of 88.9%. The methodology of this paper serves as a prototype or baseline approach for the extraction of expert knowledge and its adaptation to machine learning techniques for root cause analysis in agile environments.",9
1042,conf/kbse/LiuXZ18,kbse/ase,2018,Deep learning based feature envy detection.,"Hui Liu,Zhifeng Xu,Yanzhen Zou","ABSTRACTSoftware refactoring is widely employed to improve software quality. A key step in software refactoring is to identify which part of the software should be refactored. To facilitate the identification, a number of approaches have been proposed to identify certain structures in the code (called code smells) that suggest the possibility of refactoring. Most of such approaches rely on manually designed heuristics to map manually selected source code metrics to predictions. However, it is challenging to manually select the best features, especially textual features. It is also difficult to manually construct the optimal heuristics. To this end, in this paper we propose a deep learning based novel approach to detecting feature envy, one of the most common code smells. The key insight is that deep neural networks and advanced deep learning techniques could automatically select features (especially textual features) of source code for feature envy detection, and could automatically build the complex mapping between such features and predictions. We also propose an automatic approach to generating labeled training data for the neural network based classifier, which does not require any human intervention. Evaluation results on open-source applications suggest that the proposed approach significantly improves the state-of-the-art in both detecting feature envy smells and recommending destinations for identified smelly methods.",8
712,conf/sigsoft/LeB018,sigsoft/fse,2018,DSM: a specification mining tool using recurrent neural network based language model.,"Tien-Duy B. Le,Lingfeng Bao,David Lo","ABSTRACTFormal specifications are important but often unavailable. Furthermore, writing these specifications is time-consuming and requires skills from developers. In this work, we present Deep Specification Miner (DSM), an automated tool that applies deep learning to mine finite-state automaton (FSA) based specifications. DSM accepts as input a set of execution traces to train a Recurrent Neural Network Language Model (RNNLM). From the input traces, DSM creates a Prefix Tree Acceptor (PTA) and leverages the inferred RNNLM to extract many features. These features are then forwarded to clustering algorithms for merging similar automata states in the PTA for assembling a number of FSAs. Next, our tool performs a model selection heuristic to approximate F-measure of FSAs, and outputs the one with the highest estimated F-measure. Noticeably, our implementation of DSM provides several options that allows users to optimize quality of resultant FSAs.  Our video demonstration on the performance of DSM is publicly available at https://goo.gl/Ju4yFS.",7
286,conf/icse/MolinaDPRAF19,icse/icse,2019,Training binary classifiers as data structure invariants.,"Facundo Molina,Renzo Degiovanni,Pablo Ponzio,Germán Regis,Nazareno Aguirre,Marcelo F. Frias","We present a technique to distinguish valid from invalid data structure objects. The technique is based on building an artificial neural network, more precisely a binary classifier, and training it to identify valid and invalid instances of a data structure. The obtained classifier can then be used in place of the data structure's invariant, in order to attempt to identify (in)correct behaviors in programs manipulating the structure. In order to produce the valid objects to train the network, an assumed-correct set of object building routines is randomly executed. Invalid instances are produced by generating values for object fields that ""break"" the collected valid values, i.e., that assign values to object fields that have not been observed as feasible in the assumed-correct executions that led to the collected valid instances. We experimentally assess this approach, over a benchmark of data structures. We show that this learning technique produces classifiers that achieve significantly better accuracy in classifying valid/invalid objects compared to a technique for dynamic invariant detection, and leads to improved bug finding.",7
287,conf/icse/FanLLWNZL19,icse/icse,2019,Graph embedding based familial analysis of Android malware using unsupervised learning.,"Ming Fan,Xiapu Luo,Jun Liu,Meng Wang,Chunyin Nong,Qinghua Zheng,Ting Liu","The rapid growth of Android malware has posed severe security threats to smartphone users. On the basis of the familial trait of Android malware observed by previous work, the familial analysis is a promising way to help analysts better focus on the commonalities of malware samples within the same families, thus reducing the analytical workload and accelerating malware analysis. The majority of existing approaches rely on supervised learning and face three main challenges, i.e., low accuracy, low efficiency, and the lack of labeled dataset. To address these challenges, we first construct a fine-grained behavior model by abstracting the program semantics into a set of subgraphs. Then, we propose SRA, a novel feature that depicts the similarity relationships between the Structural Roles of sensitive API call nodes in subgraphs. An SRA is obtained based on graph embedding techniques and represented as a vector, thus we can effectively reduce the high complexity of graph matching. After that, instead of training a classifier with labeled samples, we construct malware link network based on SRAs and apply community detection algorithms on it to group the unlabeled samples into groups. We implement these ideas in a system called GefDroid that performs Graph embedding based familial analysis of AnDroid malware using unsupervised learning. Moreover, we conduct extensive experiments to evaluate GefDroid on three datasets with ground truth. The results show that GefDroid can achieve high agreements (0.707-0.883 in term of NMI) between the clustering results and the ground truth. Furthermore, GefDroid requires only linear run-time overhead and takes around 8.6s to analyze a sample on average, which is considerably faster than the previous work.",7
614,conf/sigsoft/Meijer18,sigsoft/fse,2018,Behind every great deep learning framework is an even greater programming languages concept (keynote).,Erik Meijer,"ABSTRACTIn many areas, such as image recognition, natural language processing, search, recommendation, autonomous cars, systems software and infrastructure, and even Software Engineering tools themselves, Software 2.0 (= programming using learned models) is quickly swallowing Software 1.0 (= programming using handcrafted algorithms). Where the Software 1.0 Engineer formally specifies their problem, carefully designs algorithms, composes systems out of subsystems or decomposes complex systems into smaller components, the Software 2.0 Engineer amasses training data and simply feeds it into an ML algorithm that will synthesize an approximation of the function whose partial extensional definition is that training data. Instead of code as the artifact of interest, in Software 2.0 it is all about the data where compilation of source code is replaced by training models with data. This new style of programming has far-reaching consequences for traditional software engineering practices. Everything we have learned about life cycle models, project planning and estimation, requirements analysis, program design, construction, debugging, testing, maintenance and implementation, … runs the danger of becoming obsolete.  One way to try to prepare for the new realities of software engineering is not to zero in on the differences between Software 1.0 and Software 2.0 but instead focus on their similarities. If you carefully look at what a neural net actually represents, you realize that in essence it is a pure function, from multi-dimensional arrays of floating point numbers to multi-dimensional arrays of floating point numbers (tensors). What is special about these functions is that they are differentiable (yes, exactly as you remember from middle school calculus), which allows them to be trained using back propagation. The programming language community has also discovered that there is a deep connection between back propagation and continuations. Moreover, when you look closely at how Software 2.0 Engineers construct complex neural nets like CNNs, RNNs, LSTMs, … you recognize they are (implicitly) using high-order combinators like map, fold, zip, scan, recursion, conditionals, function composition, … to compose complex neural network architectures out of simple building blocks. Constructing neural networks using pure and higher-order differentiable functions and training them using reverse-mode automatic differentiation is unsurprisingly called Differentiable Programming. This talk will illustrate the deep programming language principles behind Differentiable Programming, which will hopefully inspire the working Software 1.0 engineer to pay serious attention to the threats and opportunities of Software 2.0.",7
1495,conf/issre/WangXZLW19,issre/issre,2019,Textout: Detecting Text-Layout Bugs in Mobile Apps via Visualization-Oriented Learning.,"Yaohui Wang,Hui Xu,Yangfan Zhou,Michael R. Lyu,Xin Wang","Layout bugs commonly exist in mobile apps. Due to the fragmentation issues of smartphones, a layout bug may occur only on particular versions of smartphones. It is quite challenging to detect such bugs for state-of-the-art commercial automated testing platforms, although they can test an app with thousands of different smartphones in parallel. The main reason is that typical layout bugs neither crash an app nor generate any error messages. In this paper, we present our work for detecting text-layout bugs, which account for a large portion of layout bugs. We model text-layout bug detection as a classification problem. This then allows us to address it with sophisticated image processing and machine learning techniques. To this end, we propose an approach which we call Textout. Textout takes screenshots as its input and adopts a specifically-tailored text detection method and a convolutional neural network (CNN) classifier to perform automatic text-layout bug detection. We collect 33,102 text-region images as our training dataset and verify the effectiveness of our tool with 1,481 text-region images collected from real-world apps. Textout achieves an AUC (area under the curve) of 0.956 on the test dataset and shows an acceptable overhead. The dataset is open-source released for follow-up research.",7
826,conf/sigsoft/CambroneroLKS019,sigsoft/fse,2019,When deep learning met code search.,"José Cambronero,Hongyu Li,Seohyun Kim,Koushik Sen,Satish Chandra","ABSTRACTThere have been multiple recent proposals on using deep neural networks for code search using natural language. Common across these proposals is the idea of embedding code and natural language queries into real vectors and then using vector distance to approximate semantic correlation between code and the query. Multiple approaches exist for learning these embeddings, including unsupervised techniques, which rely only on a corpus of code examples, and supervised techniques, which use an aligned corpus of paired code and natural language descriptions. The goal of this supervision is to produce embeddings that are more similar for a query and the corresponding desired code snippet.  Clearly, there are choices in whether to use supervised techniques at all, and if one does, what sort of network and training to use for supervision. This paper is the first to evaluate these choices systematically. To this end, we assembled implementations of state-of-the-art techniques to run on a common platform, training and evaluation corpora. To explore the design space in network complexity, we also introduced a new design point that is a minimal supervision extension to an existing unsupervised technique.  Our evaluation shows that: 1. adding supervision to an existing unsupervised technique can improve performance, though not necessarily by much; 2. simple networks for supervision can be more effective that more sophisticated sequence-based networks for code search; 3. while it is common to use docstrings to carry out supervision, there is a sizeable gap between the effectiveness of docstrings and a more query-appropriate supervision corpus.",7
1399,conf/issta/WangGJXZY0S19,issta/issta,2019,Go-clone: graph-embedding based clone detector for Golang.,"Cong Wang,Jian Gao,Yu Jiang,Zhenchang Xing,Huafeng Zhang,Weiliang Yin,Ming Gu,Jiaguang Sun","ABSTRACTGolang (short for Go programming language) is a fast and compiled language, which has been increasingly used in industry due to its excellent performance on concurrent programming. Golang redefines concurrent programming grammar, making it a challenge for traditional clone detection tools and techniques. However, there exist few tools for detecting duplicates or copy-paste related bugs in Golang. Therefore, an effective and efficient code clone detector on Golang is especially needed.  In this paper, we present Go-Clone, a learning-based clone detector for Golang. Go-Clone contains two modules -- the training module and the user interaction module. In the training module, firstly we parse Golang source code into llvm IR (Intermediate Representation). Secondly, we calculate LSFG (labeled semantic flow graph) for each program function automatically. Go-Clone trains a deep neural network model to encode LSFGs for similarity classification. In the user interaction module, users can choose one or more Golang projects. Go-Clone identifies and presents a list of function pairs, which are most likely clone code for user inspection. To evaluate Go-Clone's performance, we collect 6,110 commit versions from 48 Github projects to construct a Golang clone detection data set. Go-Clone can reach the value of AUC (Area Under Curve) and ACC (Accuracy) for 89.61% and 83.80% in clone detection. By testing several groups of unfamiliar data, we also demonstrates the generility of Go-Clone. The address of the abstract demo video: https://youtu.be/o5DogtYGbeo",6
739,conf/sigsoft/Kwiatkowska19,sigsoft/fse,2019,Safety and robustness for deep learning with provable guarantees (keynote).,Marta Kwiatkowska,"ABSTRACTComputing systems are becoming ever more complex, with decisions increasingly often based on deep learning components. A wide variety of applications are being developed, many of them safety-critical, such as self-driving cars and medical diagnosis. Since deep learning is unstable with respect to adversarial perturbations, there is a need for rigorous software development methodologies that encompass machine learning components. This lecture will describe progress with developing automated verification and testing techniques for deep neural networks to ensure safety and robustness of their decisions with respect to input perturbations. The techniques exploit Lipschitz continuity of the networks and aim to approximate, for a given set of inputs, the reachable set of network outputs in terms of lower and upper bounds, in anytime manner, with provable guarantees. We develop novel algorithms based on feature-guided search, games, global optimisation and Bayesian methods, and evaluate them on state-of-the-art networks. The lecture will conclude with an overview of the challenges in this field.",6
822,conf/sigsoft/0001RJGA19,sigsoft/fse,2019,DeepDelta: learning to repair compilation errors.,"Ali Mesbah,Andrew Rice,Emily Johnston,Nick Glorioso,Edward Aftandilian","ABSTRACTProgrammers spend a substantial amount of time manually repairing code that does not compile. We observe that the repairs for any particular error class typically follow a pattern and are highly mechanical. We propose a novel approach that automatically learns these patterns with a deep neural network and suggests program repairs for the most costly classes of build-time compilation failures. We describe how we collect all build errors and the human-authored, in-progress code changes that cause those failing builds to transition to successful builds at Google. We generate an AST diff from the textual code changes and transform it into a domain-specific language called Delta that encodes the change that must be made to make the code compile. We then feed the compiler diagnostic information (as source) and the Delta changes that resolved the diagnostic (as target) into a Neural Machine Translation network for training. For the two most prevalent and costly classes of Java compilation errors, namely missing symbols and mismatched method signatures, our system called DeepDelta, generates the correct repair changes for 19,314 out of 38,788 (50%) of unseen compilation errors. The correct changes are in the top three suggested fixes 86% of the time on average.",6
462,conf/icst/KocWFCP19,icst/icst,2019,An Empirical Assessment of Machine Learning Approaches for Triaging Reports of a Java Static Analysis Tool.,"Ugur Koc,Shiyi Wei,Jeffrey S. Foster,Marine Carpuat,Adam A. Porter","Despite their ability to detect critical bugs in software, developers consider high false positive rates to be a key barrier to using static analysis tools in practice. To improve the usability of these tools, researchers have recently begun to apply machine learning techniques to classify and filter false positive analysis reports. Although initial results have been promising, the long-term potential and best practices for this line of research are unclear due to the lack of detailed, large-scale empirical evaluation. To partially address this knowledge gap, we present a comparative empirical study of four machine learning techniques, namely hand-engineered features, bag of words, recurrent neural networks, and graph neural networks, for classifying false positives, using multiple ground-truth program sets. We also introduce and evaluate new data preparation routines for recurrent neural networks and node representations for graph neural networks, and show that these routines can have a substantial positive impact on classification accuracy. Overall, our results suggest that recurrent neural networks (which learn over a program's source code) outperform the other subject techniques, although interesting tradeoffs are present among all techniques. Our observations provide insight into the future research needed to speed the adoption of machine learning approaches in practice.",6
1336,conf/issta/LeL18,issta/issta,2018,Deep specification mining.,"Tien-Duy B. Le,David Lo","ABSTRACTFormal specifcations are essential but usually unavailable in software systems. Furthermore, writing these specifcations is costly and requires skills from developers. Recently, many automated techniques have been proposed to mine specifcations in various formats including fnite-state automaton (FSA). However, more works in specifcation mining are needed to further improve the accuracy of the inferred specifcations. In this work, we propose Deep Specifcation Miner (DSM), a new approach that performs deep learning for mining FSA-based specifcations. Our proposed approach uses test case generation to generate a richer set of execution traces for training a Recurrent Neural Network Based Language Model (RNNLM). From these execution traces, we construct a Prefx Tree Acceptor (PTA) and use the learned RNNLM to extract many features. These features are subsequently utilized by clustering algorithms to merge similar automata states in the PTA for constructing a number of FSAs. Then, our approach performs a model selection heuristic to estimate F-measure of FSAs and returns the one with the highest estimated Fmeasure. We execute DSM to mine specifcations of 11 target library classes. Our empirical analysis shows that DSM achieves an average F-measure of 71.97%, outperforming the best performing baseline by 28.22%. We also demonstrate the value of DSM in sandboxing Android apps.",6
750,conf/sigsoft/FucciMM19,sigsoft/fse,2019,On using machine learning to identify knowledge in API reference documentation.,"Davide Fucci,Alireza Mollaalizadehbahnemiri,Walid Maalej","ABSTRACTUsing API reference documentation like JavaDoc is an integral part of software development. Previous research introduced a grounded taxonomy that organizes API documentation knowledge in 12 types, including knowledge about the Functionality, Structure, and Quality of an API. We study how well modern text classification approaches can automatically identify documentation containing specific knowledge types. We compared conventional machine learning (k-NN and SVM) with deep learning approaches trained on manually-annotated Java and .NET API documentation (n = 5,574). When classifying the knowledge types individually (i.e., multiple binary classifiers) the best AUPRC was up to 87",6
315,conf/icse/HaZ19,icse/icse,2019,DeepPerf: performance prediction for configurable software with deep sparse neural network.,"Huong Ha,Hongyu Zhang","Many software systems provide users with a set of configuration options and different configurations may lead to different runtime performance of the system. As the combination of configurations could be exponential, it is difficult to exhaustively deploy and measure system performance under all possible configurations. Recently, several learning methods have been proposed to build a performance prediction model based on performance data collected from a small sample of configurations, and then use the model to predict system performance under a new configuration. In this paper, we propose a novel approach to model highly configurable software system using a deep feedforward neural network (FNN) combined with a sparsity regularization technique, e.g. the L1 regularization. Besides, we also design a practical search strategy for automatically tuning the network hyperparameters efficiently. Our method, called DeepPerf, can predict performance values of highly configurable software systems with binary and/or numeric configuration options at much higher prediction accuracy with less training data than the state-of-the art approaches. Experimental results on eleven public real-world datasets confirm the effectiveness of our approach.",6
1196,conf/kbse/MuGCCGXMS19,kbse/ase,2019,RENN: Efficient Reverse Execution with Neural-Network-Assisted Alias Analysis.,"Dongliang Mu,Wenbo Guo,Alejandro Cuevas,Yueqi Chen,Jinxuan Gai,Xinyu Xing,Bing Mao,Chengyu Song","Reverse execution and coredump analysis have long been used to diagnose the root cause of software crashes. Each of these techniques, however, face inherent challenges, such as insufficient capability when handling memory aliases. Recent works have used hypothesis testing to address this drawback, albeit with high computational complexity, making them impractical for real world applications. To address this issue, we propose a new deep neural architecture, which could significantly improve memory alias resolution. At the high level, our approach employs a recurrent neural network (RNN) to learn the binary code pattern pertaining to memory accesses. It then infers the memory region accessed by memory references. Since memory references to different regions naturally indicate a non-alias relationship, our neural architecture can greatly reduce the burden of doing hypothesis testing to track down non-alias relation in binary code. Different from previous researches that have utilized deep learning for other binary analysis tasks, the neural network proposed in this work is fundamentally novel. Instead of simply using off-the-shelf neural networks, we designed a new recurrent neural architecture that could capture the data dependency between machine code segments. To demonstrate the utility of our deep neural architecture, we implement it as RENN, a neural network-assisted reverse execution system. We utilize this tool to analyze software crashes corresponding to 40 memory corruption vulnerabilities from the real world. Our experiments show that RENN can significantly improve the efficiency of locating the root cause for the crashes. Compared to a state-of-the-art technique, RENN has 36.25% faster execution time on average, detects an average of 21.35% more non-alias pairs, and successfully identified the root cause of 12.5% more cases.",6
