,Id,Conf,Year,Title,Authors,Abstract,ml_score
1335,conf/issta/CumminsPML18,issta/issta,2018,Compiler fuzzing through deep learning.,"Chris Cummins,Pavlos Petoumenos,Alastair Murray,Hugh Leather","ABSTRACTRandom program generation — fuzzing — is an effective technique for discovering bugs in compilers but successful fuzzers require extensive development effort for every language supported by the compiler, and often leave parts of the language space untested. We introduce DeepSmith, a novel machine learning approach to accelerating compiler validation through the inference of generative models for compiler inputs. Our approach infers a learned model of the structure of real world code based on a large corpus of open source code. Then, it uses the model to automatically generate tens of thousands of realistic programs. Finally, we apply established differential testing methodologies on them to expose bugs in compilers. We apply our approach to the OpenCL programming language, automatically exposing bugs with little effort on our side. In 1,000 hours of automated testing of commercial and open source compilers, we discover bugs in all of them, submitting 67 bug reports. Our test cases are on average two orders of magnitude smaller than the state-of-the-art, require 3.03× less time to generate and evaluate, and expose bugs which the state-of-the-art cannot. Our random program generator, comprising only 500 lines of code, took 12 hours to train for OpenCL versus the state-of-the-art taking 9 man months to port from a generator for C and 50,000 lines of code. With 18 lines of code we extended our program generator to a second language, uncovering crashes in Solidity compilers in 12 hours of automated testing.",4
1509,conf/issre/Valentim0A19,issre/issre,2019,The Impact of Data Preparation on the Fairness of Software Systems.,"Inês Valentim,Nuno Lourenço,Nuno Antunes","Machine learning models are widely adopted in scenarios that directly affect people. The development of software systems based on these models raises societal and legal concerns, as their decisions may lead to the unfair treatment of individuals based on attributes like race or gender. Data preparation is key in any machine learning pipeline, but its effect on fairness is yet to be studied in detail. In this paper, we evaluate how the fairness and effectiveness of the learned models are affected by the removal of the sensitive attribute, the encoding of the categorical attributes, and instance selection methods (including cross-validators and random undersampling). We used the Adult Income and the German Credit Data datasets, which are widely studied and known to have fairness concerns. We applied each data preparation technique individually to analyse the difference in predictive performance and fairness, using statistical parity difference, disparate impact, and the normalised prejudice index. The results show that fairness is affected by transformations made to the training data, particularly in imbalanced datasets. Removing the sensitive attribute is insufficient to eliminate all the unfairness in the predictions, as expected, but it is key to achieve fairer models. Additionally, the standard random undersampling with respect to the true labels is sometimes more prejudicial than performing no random undersampling.",4
1490,conf/issre/XuZZTLLKC19,issre/issre,2019,Identifying Crashing Fault Residence Based on Cross Project Model.,"Zhou Xu,Tao Zhang,Yifeng Zhang,Yutian Tang,Jin Liu,Xiapu Luo,Jacky Keung,Xiaohui Cui","Analyzing the crash reports recorded upon software crashes is a critical activity for software quality assurance. Predicting whether or not the fault causing the crash (crashing fault for short) resides in the stack traces of crash reports can speed-up the program debugging process and determine the priority of the debugging efforts. Previous work mostly collected label information from bug-fixing logs, and extracted crash features from stack traces and source code to train classification models for the Identification of Crashing Fault Residence (ICFR) of newly-submitted crashes. However, labeled data are not always fully available in real applications. Hence the classifier training is not always feasible. In this work, we make the first attempt to develop a cross project ICFR model to address the data scarcity problem. This is achieved by transferring the knowledge from external projects to the current project via utilizing a state-of-the-art Balanced Distribution Adaptation (BDA) based transfer learning method. BDA not only combines both marginal distribution and conditional distribution across projects but also assigns adaptive weights to the two distributions for better adjusting specific cross project pair. The experiments on 7 software projects show that BDA is superior to 9 baseline methods in terms of 6 indicators overall.",4
1512,conf/issre/MerrerT19,issre/issre,2019,TamperNN: Efficient Tampering Detection of Deployed Neural Nets.,"Erwan Le Merrer,Gilles Trédan","Neural networks are powering the deployment of embedded devices and Internet of Things. Applications range from personal assistants to critical ones such as self-driving cars. It has been shown recently that models obtained from neural nets can be trojaned; an attacker can then trigger an arbitrary model behavior facing crafted inputs. This has a critical impact on the security and reliability of those deployed devices. We introduce novel algorithms to detect the tampering with deployed models, classifiers in particular. In the remote interaction setup we consider, the proposed strategy is to identify markers of the model input space that are likely to change class if the model is attacked, allowing a user to detect a possible tampering. This setup makes our proposal compatible with a wide range of scenarios, such as embedded models, or models exposed through prediction APIs. We experiment those tampering detection algorithms on the canonical MNIST dataset, over three different types of neural nets, and facing five different attacks (trojaning, quantization, fine-tuning, compression and watermarking). We then validate over five large models (VGG16, VGG19, ResNet, MobileNet, DenseNet) with a state of the art dataset (VGGFace2), and report results demonstrating the possibility of an efficient detection of model tampering.",4
1460,conf/issre/MaZSXLJXLLZW18,issre/issre,2018,DeepMutation: Mutation Testing of Deep Learning Systems.,"Lei Ma,Fuyuan Zhang,Jiyuan Sun,Minhui Xue,Bo Li,Felix Juefei-Xu,Chao Xie,Li Li,Yang Liu,Jianjun Zhao,Yadong Wang","Deep learning (DL) defines a new data-driven programming paradigm where the internal system logic is largely shaped by the training data. The standard way of evaluating DL models is to examine their performance on a test dataset. The quality of the test dataset is of great importance to gain confidence of the trained models. Using an inadequate test dataset, DL models that have achieved high test accuracy may still lack generality and robustness. In traditional software testing, mutation testing is a well-established technique for quality evaluation of test suites, which analyzes to what extent a test suite detects the injected faults. However, due to the fundamental difference between traditional software and deep learning-based software, traditional mutation testing techniques cannot be directly applied to DL systems. In this paper, we propose a mutation testing framework specialized for DL systems to measure the quality of test data. To do this, by sharing the same spirit of mutation testing in traditional software, we first define a set of source-level mutation operators to inject faults to the source of DL (i.e., training data and training programs). Then we design a set of model-level mutation operators that directly inject faults into DL models without a training process. Eventually, the quality of test data could be evaluated from the analysis on to what extent the injected faults could be detected. The usefulness of the proposed mutation testing techniques is demonstrated on two public datasets, namely MNIST and CIFAR-10, with three DL models.",4
1428,conf/issre/HuangLXWL17,issre/issre,2017,Which Packages Would be Affected by This Bug Report?,"Qiao Huang,David Lo,Xin Xia,Qingye Wang,Shanping Li","A large project (e.g., Ubuntu) usually contains a large number of software packages. Sometimes the same bug report in such project would affect multiple packages, and developers of different packages need to collaborate with one another to fix the bug. Unfortunately, the total number of packages involved in a project like Ubuntu is relatively large, which makes it time-consuming to manually identify packages that are affected by a bug report. In this paper, we propose an approach named PkgRec that consists of 2 components: a name matching component and an ensemble learning component. In the name matching component, we assign a confidence score for a package if it is mentioned by a bug report. In the ensemble learning component, we divide the training dataset into n subsets and build a sub-classifier on each subset. Then we automatically determine an appropriate weight for each sub-classifier and combine them to predict the confidence score of a package being affected by a new bug report. Finally, PkgRec combines the name matching component and the ensemble learning component to assign a final confidence score to each potential package. A list of top-k packages with the highest confidence scores would then be recommended. We evaluate PkgRec on 3 datasets including Ubuntu, OpenStack, and GNOME with a total number of 42,094 bug reports. We show that PkgRec could achieve recall@5 and recall@10 scores of 0.511-0.737, and 0.614-0.785, respectively. We also compare PkgRec with other state-of-art approaches, namely LDA-KL and MLkNN. The experiment results show that PkgRec on average improves recall@5 and recall@10 scores of LDA-KL by 47% and 31%, and MLkNN by 52% and 37%, respectively.",4
1393,conf/issta/WhiteFB19,issta/issta,2019,Improving random GUI testing with image-based widget detection.,"Thomas D. White,Gordon Fraser,Guy J. Brown","ABSTRACTGraphical User Interfaces (GUIs) are amongst the most common user interfaces, enabling interactions with applications through mouse movements and key presses. Tools for automated testing of programs through their GUI exist, however they usually rely on operating system or framework specific knowledge to interact with an application. Due to frequent operating system updates, which can remove required information, and a large variety of different GUI frameworks using unique underlying data structures, such tools rapidly become obsolete, Consequently, for an automated GUI test generation tool, supporting many frameworks and operating systems is impractical. We propose a technique for improving GUI testing by automatically identifying GUI widgets in screen shots using machine learning techniques. As training data, we generate randomized GUIs to automatically extract widget information. The resulting model provides guidance to GUI testing tools in environments not currently supported by deriving GUI widget information from screen shots only. In our experiments, we found that identifying GUI widgets in screen shots and using this information to guide random testing achieved a significantly higher branch coverage in 18 of 20 applications, with an average increase of 42.5% when compared to conventional random testing.",4
1426,conf/issre/XiaoZYTDC17,issre/issre,2017,Experience Report: Fault Triggers in Linux Operating System: from Evolution Perspective.,"Guanping Xiao,Zheng Zheng,Beibei Yin,Kishor S. Trivedi,Xiaoting Du,Kai-Yuan Cai","Linux operating system is a complex system that is prone to suffer failures during usage, and increases difficulties of fixing bugs. Different testing strategies and fault mitigation methods can be developed and applied based on different types of bugs, which leads to the necessity to have a deep understanding of the nature of bugs in Linux. In this paper, an empirical study is carried out on 5741 bug reports of Linux kernel from an evolution perspective. A bug classification is conducted based on fault triggering conditions, followed by the analysis of the evolution of bug type proportions over versions and time, together with their comparisons across versions, products and regression bugs. Moreover, the relationship between bug type proportions and clustering coefficient, as well as the relation between bug types and time to fix are presented. This paper reveals 13 interesting findings based on the empirical results and further provides guidance for developers and users based on these findings.",4
449,conf/icst/KooS0B19,icst/icst,2019,PySE: Automatic Worst-Case Test Generation by Reinforcement Learning.,"Jinkyu Koo,Charitha Saumya,Milind Kulkarni,Saurabh Bagchi","Stress testing is an important task in software testing, which examines the behavior of a program under a heavy load. Symbolic execution is a useful tool to find out the worst-case input values for the stress testing. However, symbolic execution does not scale to a large program, since the number of paths to search grows exponentially with an input size. So far, such a scalability issue has been mostly managed by pruning out unpromising paths in the middle of searching based on heuristics, but this kind of work easily eliminates the true worst case as well, providing sub-optimal one only. Another way to achieve scalability is to learn a branching policy of worst-case complexity from small scale tests and apply it to a large scale. However, use cases of such a method are restricted to programs whose worst-case branching policy has a simple pattern. To address such limitations, we propose PySE that uses symbolic execution to collect the behaviors of a given branching policy, and updates the policy using a reinforcement learning approach through multiple executions. PySE's branching policy keeps evolving in a way that the length of an execution path increases in the long term, and ultimately reaches the worst-case complexity. PySE can also learn the worst-case branching policy of a complex or irregular pattern, using an artificial neural network in a fully automatic way. Experiment results demonstrate that PySE can effectively find a path of worst-case complexity for various Python benchmark programs and scales.",3
972,conf/kbse/ZamaniradBBC017,kbse/ase,2017,Programming bots by synthesizing natural language expressions into API invocations.,"Shayan Zamanirad,Boualem Benatallah,Moshe Chai Barukh,Fabio Casati,Carlos Rodríguez","At present, bots are still in their preliminary stages of development. Many are relatively simple, or developed ad-hoc for a very specific use-case. For this reason, they are typically programmed manually, or utilize machine-learning classifiers to interpret a fixed set of user utterances. In reality, real world conversations with humans require support for dynamically capturing users expressions. Moreover, bots will derive immeasurable value by programming them to invoke APIs for their results. Today, within the Web and Mobile development community, complex applications are being stringed together with a few lines of code - all made possible by APIs. Yet, developers today are not as empowered to program bots in much the same way. To overcome this, we introduce BotBase, a bot programming platform that dynamically synthesizes natural language user expressions into API invocations. Our solution is two faceted: Firstly, we construct an API knowledge graph to encode and evolve APIs; secondly, leveraging the above we apply techniques in NLP, ML and Entity Recognition to perform the required synthesis from natural language user expressions into API calls.",3
612,conf/sigsoft/Mills17,sigsoft/fse,2017,Automating traceability link recovery through classification.,Chris Mills,"ABSTRACT Traceability Link Recovery (TLR) is an important software engineering task in which a stakeholder establishes links between related items in two sets of software artifacts. Most existing approaches leverage Information Retrieval (IR) techniques, and formulate the TLR task as a retrieval problem, where pairs of similar artifacts are retrieved and presented to a user. These approaches still require significant human effort, as a stakeholder needs to manually inspect the list of recommendations and decide which ones are true links and which ones are false. In this work, we aim to automate TLR by re-imagining it as a binary classification problem. More specifically, our machine learning classification approach is able to automatically classify each link in the set of all potential links as either valid or invalid, therefore circumventing the substantial human effort required by existing techniques.",3
1214,conf/kbse/DuCWLSC19,kbse/ase,2019,CocoQa: Question Answering for Coding Conventions Over Knowledge Graphs.,"Tianjiao Du,Junming Cao,Qinyue Wu,Wei Li,Beijun Shen,Yuting Chen","Coding convention plays an important role in guaranteeing software quality. However, coding conventions are usually informally presented and inconvenient for programmers to use. In this paper, we present CocoQa, a system that answers programmer's questions about coding conventions. CocoQa answers questions by querying a knowledge graph for coding conventions. It employs 1) a subgraph matching algorithm that parses the question into a SPARQL query, and 2) a machine comprehension algorithm that uses an end-to-end neural network to detect answers from searched paragraphs. We have implemented CocoQa, and evaluated it on a coding convention QA dataset. The results show that CocoQa can answer questions about coding conventions precisely. In particular, CocoQa can achieve a precision of 82.92% and a recall of 91.10%. Repository: https://github.com/14dtj/CocoQa/ Video: https://youtu.be/VQaXi1WydAU.",3
102,conf/icse/TianPJR18,icse/icse,2018,DeepTest: automated testing of deep-neural-network-driven autonomous cars.,"Yuchi Tian,Kexin Pei,Suman Jana,Baishakhi Ray","ABSTRACTRecent advances in Deep Neural Networks (DNNs) have led to the development of DNN-driven autonomous cars that, using sensors like camera, LiDAR, etc., can drive without any human intervention. Most major manufacturers including Tesla, GM, Ford, BMW, and Waymo/Google are working on building and testing different types of autonomous vehicles. The lawmakers of several US states including California, Texas, and New York have passed new legislation to fast-track the process of testing and deployment of autonomous vehicles on their roads.However, despite their spectacular progress, DNNs, just like traditional software, often demonstrate incorrect or unexpected corner-case behaviors that can lead to potentially fatal collisions. Several such real-world accidents involving autonomous cars have already happened including one which resulted in a fatality. Most existing testing techniques for DNN-driven vehicles are heavily dependent on the manual collection of test data under different driving conditions which become prohibitively expensive as the number of test conditions increases.In this paper, we design, implement, and evaluate DeepTest, a systematic testing tool for automatically detecting erroneous behaviors of DNN-driven vehicles that can potentially lead to fatal crashes. First, our tool is designed to automatically generated test cases leveraging real-world changes in driving conditions like rain, fog, lighting conditions, etc. DeepTest systematically explore different parts of the DNN logic by generating test inputs that maximize the numbers of activated neurons. DeepTest found thousands of erroneous behaviors under different realistic driving conditions (e.g., blurring, rain, fog, etc.) many of which lead to potentially fatal crashes in three top performing DNNs in the Udacity self-driving car challenge.",3
1002,conf/kbse/Sultana17,kbse/ase,2017,Towards a software vulnerability prediction model using traceable code patterns and software metrics.,Kazi Zakia Sultana,"Software security is an important aspect of ensuring software quality. The goal of this study is to help developers evaluate software security using traceable patterns and software metrics during development. The concept of traceable patterns is similar to design patterns but they can be automatically recognized and extracted from source code. If these patterns can better predict vulnerable code compared to traditional software metrics, they can be used in developing a vulnerability prediction model to classify code as vulnerable or not. By analyzing and comparing the performance of traceable patterns with metrics, we propose a vulnerability prediction model. This study explores the performance of some code patterns in vulnerability prediction and compares them with traditional software metrics. We use the findings to build an effective vulnerability prediction model. We evaluate security vulnerabilities reported for Apache Tomcat, Apache CXF and three stand-alone Java web applications. We use machine learning and statistical techniques for predicting vulnerabilities using traceable patterns and metrics as features. We found that patterns have a lower false negative rate and higher recall in detecting vulnerable code than the traditional software metrics.",3
457,conf/icst/WangWZK19,icst/icst,2019,Learning to Optimize the Alloy Analyzer.,"Wenxi Wang,Kaiyuan Wang,Mengshi Zhang,Sarfraz Khurshid","Constraint-solving is an expensive phase for scenario finding tools. It has been widely observed that there is no single ""dominant"" SAT solver that always wins in every case; instead, the performance of different solvers varies by cases. Some SAT solvers perform particularly well for certain tasks while other solvers perform well for other tasks. In this paper, we propose an approach that uses machine learning techniques to automatically select a SAT solver for one of the widely used scenario finding tools, i.e. Alloy Analyzer, based on the features extracted from a given model. The goal is to choose the best SAT solver for a given model to minimize the expensive constraint solving time. We extract features from three different levels, i.e. the Alloy source code level, the Kodkod formula level and the boolean formula level. The experimental results show that our portfolio approach outperforms the best SAT solver by 30% as well as the baseline approach by 128% where users randomly select a solver for any given model.",3
185,conf/icse/GuZ018,icse/icse,2018,Deep code search.,"Xiaodong Gu,Hongyu Zhang,Sunghun Kim","ABSTRACTTo implement a program functionality, developers can reuse previously written code snippets by searching through a large-scale codebase. Over the years, many code search tools have been proposed to help developers. The existing approaches often treat source code as textual documents and utilize information retrieval models to retrieve relevant code snippets that match a given query. These approaches mainly rely on the textual similarity between source code and natural language query. They lack a deep understanding of the semantics of queries and source code.In this paper, we propose a novel deep neural network named CODEnn (Code-Description Embedding Neural Network). Instead of matching text similarity, CODEnn jointly embeds code snippets and natural language descriptions into a high-dimensional vector space, in such a way that code snippet and its corresponding description have similar vectors. Using the unified vector representation, code snippets related to a natural language query can be retrieved according to their vectors. Semantically related words can also be recognized and irrelevant/noisy keywords in queries can be handled.As a proof-of-concept application, we implement a code search tool named DeepCS using the proposed CODEnn model. We empirically evaluate DeepCS on a large scale codebase collected from GitHub. The experimental results show that our approach can effectively retrieve relevant code snippets and outperforms previous techniques.",3
1476,conf/issre/SalayAC19,issre/issre,2019,A Safety Analysis Method for Perceptual Components in Automated Driving.,"Rick Salay,Matt Angus,Krzysztof Czarnecki","The use of machine learning (ML) is increasing in many sectors of safety-critical software development and in particular, for the perceptual components of automated driving (AD) functionality. Although some traditional safety engineering techniques such as FTA and FMEA are applicable to ML components, the unique characteristics of ML create challenges. In this paper, we propose a novel safety analysis method called Classification Failure Mode Effects Analysis (CFMEA) which is specialized to assess classification-based perception in AD. Specifically, it defines a systematic way to assess the risk due to classification failure under adversarial attacks or varying degrees of classification uncertainty across the perception-control linkage. We first present the theoretical and methodological foundations for CFMEA, and then demonstrate it by applying it to an AD case study using semantic segmentation perception trained with the Cityscapes driving dataset. Finally, we discuss how CFMEA results could be used to improve an ML-model.",3
