,Id,Conf,Year,Title,Authors,Abstract,ml_score
628,conf/sigsoft/ZhaoH18,sigsoft/fse,2018,DeepSim: deep learning code functional similarity.,"Gang Zhao,Jeff Huang","ABSTRACTMeasuring code similarity is fundamental for many software engineering tasks, e.g., code search, refactoring and reuse. However, most existing techniques focus on code syntactical similarity only, while measuring code functional similarity remains a challenging problem. In this paper, we propose a novel approach that encodes code control flow and data flow into a semantic matrix in which each element is a high dimensional sparse binary feature vector, and we design a new deep learning model that measures code functional similarity based on this representation. By concatenating hidden representations learned from a code pair, this new model transforms the problem of detecting functionally similar code to binary classification, which can effectively learn patterns between functionally similar code with very different syntactics.  We have implemented our approach, DeepSim, for Java programs and evaluated its recall, precision and time performance on two large datasets of functionally similar code. The experimental results show that DeepSim significantly outperforms existing state-of-the-art techniques, such as DECKARD, RtvNN, CDLH, and two baseline deep neural networks models.",5
631,conf/sigsoft/MaLLZG18,sigsoft/fse,2018,MODE: automated neural network model debugging via state differential analysis and input selection.,"Shiqing Ma,Yingqi Liu,Wen-Chuan Lee,Xiangyu Zhang,Ananth Grama","ABSTRACTArtificial intelligence models are becoming an integral part of modern computing systems. Just like software inevitably has bugs, models have bugs too, leading to poor classification/prediction accuracy. Unlike software bugs, model bugs cannot be easily fixed by directly modifying models. Existing solutions work by providing additional training inputs. However, they have limited effectiveness due to the lack of understanding of model misbehaviors and hence the incapability of selecting proper inputs. Inspired by software debugging, we propose a novel model debugging technique that works by first conducting model state differential analysis to identify the internal features of the model that are responsible for model bugs and then performing training input selection that is similar to program input selection in regression testing. Our evaluation results on 29 different models for 6 different applications show that our technique can fix model bugs effectively and efficiently without introducing new bugs. For simple applications (e.g., digit recognition), MODE improves the test accuracy from 75% to 93% on average whereas the state-of-the-art can only improve to 85% with 11 times more training time. For complex applications and models (e.g., object recognition), MODE is able to improve the accuracy from 75% to over 91% in minutes to a few hours, whereas state-of-the-art fails to fix the bug or even degrades the test accuracy.",5
288,conf/icse/ZhangWZ0WL19,icse/icse,2019,A novel neural source code representation based on abstract syntax tree.,"Jian Zhang,Xu Wang,Hongyu Zhang,Hailong Sun,Kaixuan Wang,Xudong Liu","Exploiting machine learning techniques for analyzing programs has attracted much attention. One key problem is how to represent code fragments well for follow-up analysis. Traditional information retrieval based methods often treat programs as natural language texts, which could miss important semantic information of source code. Recently, state-of-the-art studies demonstrate that abstract syntax tree (AST) based neural models can better represent source code. However, the sizes of ASTs are usually large and the existing models are prone to the long-term dependency problem. In this paper, we propose a novel AST-based Neural Network (ASTNN) for source code representation. Unlike existing models that work on entire ASTs, ASTNN splits each large AST into a sequence of small statement trees, and encodes the statement trees to vectors by capturing the lexical and syntactical knowledge of statements. Based on the sequence of statement vectors, a bidirectional RNN model is used to leverage the naturalness of statements and finally produce the vector representation of a code fragment. We have applied our neural network based source code representation method to two common program comprehension tasks: source code classification and code clone detection. Experimental results on the two tasks indicate that our model is superior to state-of-the-art approaches.",4
278,conf/icse/CabralMSM19,icse/icse,2019,Class imbalance evolution and verification latency in just-in-time software defect prediction.,"George G. Cabral,Leandro L. Minku,Emad Shihab,Suhaib Mujahid","Just-in-Time Software Defect Prediction (JIT-SDP) is an SDP approach that makes defect predictions at the software change level. Most existing JIT-SDP work assumes that the characteristics of the problem remain the same over time. However, JIT-SDP may suffer from class imbalance evolution. Specifically, the imbalance status of the problem (i.e., how much underrepresented the defect-inducing changes are) may be intensified or reduced over time. If occurring, this could render existing JIT-SDP approaches unsuitable, including those that re-build classifiers over time using only recent data. This work thus provides the first investigation of whether class imbalance evolution poses a threat to JIT-SDP. This investigation is performed in a realistic scenario by taking into account verification latency -- the often overlooked fact that labeled training examples arrive with a delay. Based on 10 GitHub projects, we show that JIT-SDP suffers from class imbalance evolution, significantly hindering the predictive performance of existing JIT-SDP approaches. Compared to state-of-the-art class imbalance evolution learning approaches, the predictive performance of JIT-SDP approaches was up to 97.2% lower in terms of g-mean. Hence, it is essential to tackle class imbalance evolution in JIT-SDP. We then propose a novel class imbalance evolution approach for the specific context of JIT-SDP. While maintaining top ranked g-means, this approach managed to produce up to 63.59% more balanced recalls on the defect-inducing and clean classes than state-of-the-art class imbalance evolution approaches. We thus recommend it to avoid overemphasizing one class over the other in JIT-SDP.",4
76,conf/icse/BhatiaKS18,icse/icse,2018,Neuro-symbolic program corrector for introductory programming assignments.,"Sahil Bhatia,Pushmeet Kohli,Rishabh Singh","ABSTRACTAutomatic correction of programs is a challenging problem with numerous real world applications in security, verification, and education. One application that is becoming increasingly important is the correction of student submissions in online courses for providing feedback. Most existing program repair techniques analyze Abstract Syntax Trees (ASTs) of programs, which are unfortunately unavailable for programs with syntax errors. In this paper, we propose a novel Neuro-symbolic approach that combines neural networks with constraint-based reasoning. Specifically, our method first uses a Recurrent Neural Network (RNN) to perform syntax repairs for the buggy programs; subsequently, the resulting syntactically-fixed programs are repaired using constraint-based techniques to ensure functional correctness. The RNNs are trained using a corpus of syntactically correct submissions for a given programming assignment, and are then queried to fix syntax errors in an incorrect programming submission by replacing or inserting the predicted tokens at the error location. We evaluate our technique on a dataset comprising of over 14,500 student submissions with syntax errors. Our method is able to repair syntax errors in 60% (8689) of submissions, and finds functionally correct repairs for 23.8% (3455) submissions.",4
1157,conf/kbse/BaoLWF19,kbse/ase,2019,ACTGAN: Automatic Configuration Tuning for Software Systems with Generative Adversarial Networks.,"Liang Bao,Xin Liu,Fangzheng Wang,Baoyin Fang","Complex software systems often provide a large number of parameters so that users can configure them for their specific application scenarios. However, configuration tuning requires a deep understanding of the software system, far beyond the abilities of typical system users. To address this issue, many existing approaches focus on exploring and learning good performance estimation models. The accuracy of such models often suffers when the number of available samples is small, a thorny challenge under a given tuning-time constraint. By contrast, we hypothesize that good configurations often share certain hidden structures. Therefore, instead of trying to improve the performance estimation of a given configuration, we focus on capturing the hidden structures of good configurations and utilizing such learned structure to generate potentially better configurations. We propose ACTGAN to achieve this goal. We have implemented and evaluated ACTGAN using 17 workloads with eight different software systems. Experimental results show that ACTGAN outperforms default configurations by 76.22% on average, and six state-of-the-art configuration tuning algorithms by 6.58%-64.56%. Furthermore, the ACTGAN-generated configurations are often better than those used in training and show certain features consisting with domain knowledge, both of which supports our hypothesis.",4
1205,conf/kbse/NafiKRRS19,kbse/ase,2019,CLCDSA: Cross Language Code Clone Detection using Syntactical Features and API Documentation.,"Kawser Wazed Nafi,Tonny Shekha Kar,Banani Roy,Chanchal K. Roy,Kevin A. Schneider","Software clones are detrimental to software maintenance and evolution and as a result many clone detectors have been proposed. These tools target clone detection in software applications written in a single programming language. However, a software application may be written in different languages for different platforms to improve the application's platform compatibility and adoption by users of different platforms. Cross language clones (CLCs) introduce additional challenges when maintaining multi-platform applications and would likely go undetected using existing tools. In this paper, we propose CLCDSA, a cross language clone detector which can detect CLCs without extensive processing of the source code and without the need to generate an intermediate representation. The proposed CLCDSA model analyzes different syntactic features of source code across different programming languages to detect CLCs. To support large scale clone detection, the CLCDSA model uses an action filter based on cross language API call similarity to discard non-potential clones. The design methodology of CLCDSA is two-fold: (a) it detects CLCs on the fly by comparing the similarity of features, and (b) it uses a deep neural network based feature vector learning model to learn the features and detect CLCs. Early evaluation of the model observed an average precision, recall and F-measure score of 0.55, 0.86, and 0.64 respectively for the first phase and 0.61, 0.93, and 0.71 respectively for the second phase which indicates that CLCDSA outperforms all available models in detecting cross language clones.",4
80,conf/icse/0008ZBPLO18,icse/icse,2018,Sentiment analysis for software engineering: how far can we go?,"Bin Lin,Fiorella Zampetti,Gabriele Bavota,Massimiliano Di Penta,Michele Lanza,Rocco Oliveto","ABSTRACTSentiment analysis has been applied to various software engineering (SE) tasks, such as evaluating app reviews or analyzing developers' emotions in commit messages. Studies indicate that sentiment analysis tools provide unreliable results when used out-of-the-box, since they are not designed to process SE datasets. The silver bullet for a successful application of sentiment analysis tools to SE datasets might be their customization to the specific usage context.We describe our experience in building a software library recommender exploiting developers' opinions mined from Stack Overflow. To reach our goal, we retrained---on a set of 40k manually labeled sentences/words extracted from Stack Overflow---a state-of-the-art sentiment analysis tool exploiting deep learning. Despite such an effort- and time-consuming training process, the results were negative. We changed our focus and performed a thorough investigation of the accuracy of commonly used tools to identify the sentiment of SE related texts. Meanwhile, we also studied the impact of different datasets on tool performance. Our results should warn the research community about the strong limitations of current sentiment analysis tools.",4
1120,conf/kbse/BuiYJ19,kbse/ase,2019,AutoFocus: Interpreting Attention-Based Neural Networks by Code Perturbation.,"Nghi D. Q. Bui,Yijun Yu,Lingxiao Jiang","Despite being adopted in software engineering tasks, deep neural networks are treated mostly as a black box due to the difficulty in interpreting how the networks infer the outputs from the inputs. To address this problem, we propose AutoFocus, an automated approach for rating and visualizing the importance of input elements based on their effects on the outputs of the networks. The approach is built on our hypotheses that (1) attention mechanisms incorporated into neural networks can generate discriminative scores for various input elements and (2) the discriminative scores reflect the effects of input elements on the outputs of the networks. This paper verifies the hypotheses by applying AutoFocus on the task of algorithm classification (i.e., given a program source code as input, determine the algorithm implemented by the program). AutoFocus identifies and perturbs code elements in a program systematically, and quantifies the effects of the perturbed elements on the network's classification results. Based on evaluation on more than 1000 programs for 10 different sorting algorithms, we observe that the attention scores are highly correlated to the effects of the perturbed code elements. Such a correlation provides a strong basis for the uses of attention scores to interpret the relations between code elements and the algorithm classification results of a neural network, and we believe that visualizing code elements in an input program ranked according to their attention scores can facilitate faster program comprehension with reduced code.",4
1085,conf/kbse/TufanoWBPWP18,kbse/ase,2018,An empirical investigation into learning bug-fixing patches in the wild via neural machine translation.,"Michele Tufano,Cody Watson,Gabriele Bavota,Massimiliano Di Penta,Martin White,Denys Poshyvanyk","ABSTRACTMillions of open-source projects with numerous bug fixes are available in code repositories. This proliferation of software development histories can be leveraged to learn how to fix common programming bugs. To explore such a potential, we perform an empirical study to assess the feasibility of using Neural Machine Translation techniques for learning bug-fixing patches for real defects. We mine millions of bug-fixes from the change histories of GitHub repositories to extract meaningful examples of such bug-fixes. Then, we abstract the buggy and corresponding fixed code, and use them to train an Encoder-Decoder model able to translate buggy code into its fixed version. Our model is able to fix hundreds of unique buggy methods in the wild. Overall, this model is capable of predicting fixed patches generated by developers in 9% of the cases.",4
1049,conf/kbse/AlizadehK18,kbse/ase,2018,Reducing interactive refactoring effort via clustering-based multi-objective search.,"Vahid Alizadeh,Marouane Kessentini","ABSTRACTRefactoring is nowadays widely adopted in the industry because bad design decisions can be very costly and extremely risky. On the one hand, automated refactoring does not always lead to the desired design. On the other hand, manual refactoring is error-prone, time-consuming and not practical for radical changes. Thus, recent research trends in the field focused on integrating developers feedback into automated refactoring recommendations because developers understand the problem domain intuitively and may have a clear target design in mind. However, this interactive process can be repetitive, expensive, and tedious since developers must evaluate recommended refactorings, and adapt them to the targeted design especially in large systems where the number of possible strategies can grow exponentially.  In this paper, we propose an interactive approach combining the use of multi-objective and unsupervised learning to reduce the developer's interaction effort when refactoring systems. We generate, first, using multi-objective search different possible refactoring strategies by finding a trade-off between several conflicting quality attributes. Then, an unsupervised learning algorithm clusters the different trade-off solutions, called the Pareto front, to guide the developers in selecting their region of interests and reduce the number of refactoring options to explore. The feedback from the developer, both at the cluster and solution levels, are used to automatically generate constraints to reduce the search space in the next iterations and focus on the region of developer preferences. We selected 14 active developers to manually evaluate the effectiveness our tool on 5 open source projects and one industrial system. The results show that the participants found their desired refactorings faster and more accurate than the current state of the art.",4
223,conf/icse/TufanoPWBP19,icse/icse,2019,On learning meaningful code changes via neural machine translation.,"Michele Tufano,Jevgenija Pantiuchina,Cody Watson,Gabriele Bavota,Denys Poshyvanyk","Recent years have seen the rise of Deep Learning (DL) techniques applied to source code. Researchers have exploited DL to automate several development and maintenance tasks, such as writing commit messages, generating comments and detecting vulnerabilities among others. One of the long lasting dreams of applying DL to source code is the possibility to automate non-trivial coding activities. While some steps in this direction have been taken (e.g., learning how to fix bugs), there is still a glaring lack of empirical evidence on the types of code changes that can be learned and automatically applied by DL. Our goal is to make this first important step by quantitatively and qualitatively investigating the ability of a Neural Machine Translation (NMT) model to learn how to automatically apply code changes implemented by developers during pull requests. We train and experiment with the NMT model on a set of 236k pairs of code components before and after the implementation of the changes provided in the pull requests. We show that, when applied in a narrow enough context (i.e., small/medium-sized pairs of methods before/after the pull request changes), NMT can automatically replicate the changes implemented by developers during pull requests in up to 36% of the cases. Moreover, our qualitative analysis shows that the model is capable of learning and replicating a wide variety of meaningful code changes, especially refactorings and bug-fixing activities. Our results pave the way for novel research in the area of DL on code, such as the automatic learning and applications of refactoring.",4
328,conf/icse/WangD00Z19,icse/icse,2019,Adversarial sample detection for deep neural network through model mutation testing.,"Jingyi Wang,Guoliang Dong,Jun Sun,Xinyu Wang,Peixin Zhang","Deep neural networks (DNN) have been shown to be useful in a wide range of applications. However, they are also known to be vulnerable to adversarial samples. By transforming a normal sample with some carefully crafted human imperceptible perturbations, even highly accurate DNN make wrong decisions. Multiple defense mechanisms have been proposed which aim to hinder the generation of such adversarial samples. However, a recent work show that most of them are ineffective. In this work, we propose an alternative approach to detect adversarial samples at runtime. Our main observation is that adversarial samples are much more sensitive than normal samples if we impose random mutations on the DNN. We thus first propose a measure of 'sensitivity' and show empirically that normal samples and adversarial samples have distinguishable sensitivity. We then integrate statistical hypothesis testing and model mutation testing to check whether an input sample is likely to be normal or adversarial at runtime by measuring its sensitivity. We evaluated our approach on the MNIST and CIFAR10 datasets. The results show that our approach detects adversarial samples generated by state-of-the-art attacking methods efficiently and accurately.",4
652,conf/sigsoft/DeFreezTR18,sigsoft/fse,2018,Path-based function embedding and its application to error-handling specification mining.,"Daniel DeFreez,Aditya V. Thakur,Cindy Rubio-González","ABSTRACTIdentifying relationships among program elements is useful for program understanding, debugging, and analysis. One such kind of relationship is synonymy. Function synonyms are functions that play a similar role in code; examples include functions that perform initialization for different device drivers, and functions that implement different symmetric-key encryption schemes. Function synonyms are not necessarily semantically equivalent and can be syntactically dissimilar; consequently, approaches for identifying code clones or functional equivalence cannot be used to identify them. This paper presents Func2<pre>vec</pre>, a technique that learns an embedding mapping each function to a vector in a continuous vector space such that vectors for function synonyms are in close proximity. We compute the function embedding by training a neural network on sentences generated using random walks over the interprocedural control-flow graph. We show the effectiveness of Func2<pre>vec</pre> at identifying function synonyms in the Linux kernel. Finally, we apply Func2<pre>vec</pre> to the problem of mining error-handling specifications in Linux file systems and drivers. We show that the function synonyms identified by Func2<pre>vec</pre> result in error-handling specifications with high support.",4
1041,conf/kbse/LiuXHLXW18,kbse/ase,2018,Neural-machine-translation-based commit message generation: how far are we?,"Zhongxin Liu,Xin Xia,Ahmed E. Hassan,David Lo,Zhenchang Xing,Xinyu Wang","ABSTRACTCommit messages can be regarded as the documentation of software changes. These messages describe the content and purposes of changes, hence are useful for program comprehension and software maintenance. However, due to the lack of time and direct motivation, commit messages sometimes are neglected by developers. To address this problem, Jiang et al. proposed an approach (we refer to it as NMT), which leverages a neural machine translation algorithm to automatically generate short commit messages from code. The reported performance of their approach is promising, however, they did not explore why their approach performs well. Thus, in this paper, we first perform an in-depth analysis of their experimental results. We find that (1) Most of the test <pre>diffs</pre> from which NMT can generate high-quality messages are similar to one or more training <pre>diffs</pre> at the token level. (2) About 16% of the commit messages in Jiang et al.’s dataset are noisy due to being automatically generated or due to them describing repetitive trivial changes. (3) The performance of NMT declines by a large amount after removing such noisy commit messages. In addition, NMT is complicated and time-consuming. Inspired by our first finding, we proposed a simpler and faster approach, named NNGen (Nearest Neighbor Generator), to generate concise commit messages using the nearest neighbor algorithm. Our experimental results show that NNGen is over 2,600 times faster than NMT, and outperforms NMT in terms of BLEU (an accuracy measure that is widely used to evaluate machine translation systems) by 21%. Finally, we also discuss some observations for the road ahead for automated commit message generation to inspire other researchers.",4
