,Id,Conf,Year,Title,Authors,Abstract,ml_score
1012,conf/kbse/HabibP18,kbse/ase,2018,Is this class thread-safe? inferring documentation using graph-based learning.,"Andrew Habib,Michael Pradel","ABSTRACTThread-safe classes are pervasive in concurrent, object-oriented software. However, many classes lack documentation regarding their safety guarantees under multi-threaded usage. This lack of documentation forces developers who use a class in a concurrent program to either carefully inspect the implementation of the class, to conservatively synchronize all accesses to it, or to optimistically assume that the class is thread-safe. To overcome the lack of documentation, we present TSFinder, an approach to automatically classify classes as supposedly thread-safe or thread-unsafe. The key idea is to combine a lightweight static analysis that extracts a graph representation from classes with a graph-based classifier. After training the classifier with classes known to be thread-safe and thread-unsafe, it achieves an accuracy of 94.5% on previously unseen classes, enabling the approach to infer thread safety documentation with high confidence. The classifier takes about 3 seconds per class, i.e., it is efficient enough to infer documentation for many classes.",5
1019,conf/kbse/MaJZSXLCSLLZW18,kbse/ase,2018,DeepGauge: multi-granularity testing criteria for deep learning systems.,"Lei Ma,Felix Juefei-Xu,Fuyuan Zhang,Jiyuan Sun,Minhui Xue,Bo Li,Chunyang Chen,Ting Su,Li Li,Yang Liu,Jianjun Zhao,Yadong Wang","ABSTRACTDeep learning (DL) defines a new data-driven programming paradigm that constructs the internal system logic of a crafted neuron network through a set of training data. We have seen wide adoption of DL in many safety-critical scenarios. However, a plethora of studies have shown that the state-of-the-art DL systems suffer from various vulnerabilities which can lead to severe consequences when applied to real-world applications. Currently, the testing adequacy of a DL system is usually measured by the accuracy of test data. Considering the limitation of accessible high quality test data, good accuracy performance on test data can hardly provide confidence to the testing adequacy and generality of DL systems. Unlike traditional software systems that have clear and controllable logic and functionality, the lack of interpretability in a DL system makes system analysis and defect detection difficult, which could potentially hinder its real-world deployment. In this paper, we propose DeepGauge, a set of multi-granularity testing criteria for DL systems, which aims at rendering a multi-faceted portrayal of the testbed. The in-depth evaluation of our proposed testing criteria is demonstrated on two well-known datasets, five DL systems, and with four state-of-the-art adversarial attack techniques against DL. The potential usefulness of DeepGauge sheds light on the construction of more generic and robust DL systems.",5
1270,conf/kbse/Zhang19,kbse/ase,2019,A Machine Learning Based Approach to Identify SQL Injection Vulnerabilities.,Kevin Zhang,"This paper presents a machine learning classifier designed to identify SQL injection vulnerabilities in PHP code. Both classical and deep learning based machine learning algorithms were used to train and evaluate classifier models using input validation and sanitization features extracted from source code files. On ten-fold cross validations a model trained using Convolutional Neural Network(CNN) achieved the highest precision (95.4%), while a model based on Multilayer Perceptron(MLP) achieved the highest recall (63.7%) and the highest f-measure (0.746).",5
1043,conf/kbse/WanZYXY0Y18,kbse/ase,2018,Improving automatic source code summarization via deep reinforcement learning.,"Yao Wan,Zhou Zhao,Min Yang,Guandong Xu,Haochao Ying,Jian Wu,Philip S. Yu","ABSTRACTCode summarization provides a high level natural language description of the function performed by code, as it can benefit the software maintenance, code categorization and retrieval. To the best of our knowledge, most state-of-the-art approaches follow an encoder-decoder framework which encodes the code into a hidden space and then decode it into natural language space, suffering from two major drawbacks: a) Their encoders only consider the sequential content of code, ignoring the tree structure which is also critical for the task of code summarization; b) Their decoders are typically trained to predict the next word by maximizing the likelihood of next ground-truth word with previous ground-truth word given. However, it is expected to generate the entire sequence from scratch at test time. This discrepancy can cause an exposure bias issue, making the learnt decoder suboptimal. In this paper, we incorporate an abstract syntax tree structure as well as sequential content of code snippets into a deep reinforcement learning framework (i.e., actor-critic network). The actor network provides the confidence of predicting the next word according to current state. On the other hand, the critic network evaluates the reward value of all possible extensions of the current state and can provide global guidance for explorations. We employ an advantage reward composed of BLEU metric to train both networks. Comprehensive experiments on a real-world dataset show the effectiveness of our proposed model when compared with some state-of-the-art methods.",5
1149,conf/kbse/ZhangC19,kbse/ase,2019,Apricot: A Weight-Adaptation Approach to Fixing Deep Learning Models.,"Hao Zhang,W. K. Chan","A deep learning (DL) model is inherently imprecise. To address this problem, existing techniques retrain a DL model over a larger training dataset or with the help of fault injected models or using the insight of failing test cases in a DL model. In this paper, we present Apricot, a novel weight-adaptation approach to fixing DL models iteratively. Our key observation is that if the deep learning architecture of a DL model is trained over many different subsets of the original training dataset, the weights in the resultant reduced DL model (rDLM) can provide insights on the adjustment direction and magnitude of the weights in the original DL model to handle the test cases that the original DL model misclassifies. Apricot generates a set of such reduced DL models from the original DL model. In each iteration, for each failing test case experienced by the input DL model (iDLM), Apricot adjusts each weight of this iDLM toward the average weight of these rDLMs correctly classifying the test case and/or away from that of these rDLMs misclassifying the same test case, followed by training the weight-adjusted iDLM over the original training dataset to generate a new iDLM for the next iteration. The experiment using five state-of-the-art DL models shows that Apricot can increase the test accuracy of these models by 0.87%-1.55% with an average of 1.08%. The experiment also reveals the complementary nature of these rDLMs in Apricot.",5
821,conf/sigsoft/ChenCCHCM19,sigsoft/fse,2019,Predicting breakdowns in cloud services (with SPIKE).,"Jianfeng Chen,Joymallya Chakraborty,Philip Clark,Kevin Haverlock,Snehit Cherian,Tim Menzies","ABSTRACTMaintaining web-services is a mission-critical task where any down- time means loss of revenue and reputation (of being a reliable service provider). In the current competitive web services market, such a loss of reputation causes extensive loss of future revenue.  To address this issue, we developed SPIKE, a data mining tool which can predict upcoming service breakdowns, half an hour into the future. Such predictions let an organization alert and assemble the tiger team to address the problem (e.g. by reconguring cloud hardware in order to reduce the likelihood of that breakdown).  SPIKE utilizes (a) regression tree learning (with CART); (b) synthetic minority over-sampling (to handle how rare spikes are in our data); (c) hyperparameter optimization (to learn best settings for our local data) and (d) a technique we called “topology sampling” where training vectors are built from extensive details of an individual node plus summary details on all their neighbors.  In the experiments reported here, SPIKE predicted service spikes 30 minutes into future with recalls and precision of 75% and above. Also, SPIKE performed relatively better than other widely-used learning methods (neural nets, random forests, logistic regression).",5
1380,conf/issta/CordyMPT19,issta/issta,2019,Search-based test and improvement of machine-learning-based anomaly detection systems.,"Maxime Cordy,Steve Muller,Mike Papadakis,Yves Le Traon","ABSTRACTMachine-learning-based anomaly detection systems can be vulnerable to new kinds of deceptions, known as training attacks, which exploit the live learning mechanism of these systems by progressively injecting small portions of abnormal data. The injected data seamlessly swift the learned states to a point where harmful data can pass unnoticed. We focus on the systematic testing of these attacks in the context of intrusion detection systems (IDS). We propose a search-based approach to test IDS by making training attacks. Going a step further, we also propose searching for countermeasures, learning from the successful attacks and thereby increasing the resilience of the tested IDS. We evaluate our approach on a denial-of-service attack detection scenario and a dataset recording the network traffic of a real-world system. Our experiments show that our search-based attack scheme generates successful attacks bypassing the current state-of-the-art defences. We also show that our approach is capable of generating attack patterns for all configuration states of the studied IDS and that it is capable of providing appropriate countermeasures. By co-evolving our attack and defence mechanisms we succeeded at improving the defence of the IDS under test by making it resilient to 49 out of 50 independently generated attacks.",5
1177,conf/kbse/GongJWJ19,kbse/ase,2019,Empirical Evaluation of the Impact of Class Overlap on Software Defect Prediction.,"Lina Gong,Shujuan Jiang,Rongcun Wang,Li Jiang","Software defect prediction (SDP) utilizes the learning models to detect the defective modules in project, and their performance depends on the quality of training data. The previous researches mainly focus on the quality problems of class imbalance and feature redundancy. However, training data often contains some instances that belong to different class but have similar values on features, and this leads to class overlap to affect the quality of training data. Our goal is to investigate the impact of class overlap on software defect prediction. At the same time, we propose an improved K-Means clustering cleaning approach (IKMCCA) to solve both the class overlap and class imbalance problems. Specifically, we check whether K-Means clustering cleaning approach (KMCCA) or neighborhood cleaning learning (NCL) or IKMCCA is feasible to improve defect detection performance for two cases (i) within-project defect prediction (WPDP) (ii) cross-project defect prediction (CPDP). To have an objective estimate of class overlap, we carry out our investigations on 28 open source projects, and compare the performance of state-of-the-art learning models for the above-mentioned cases by using IKMCCA or KMCCA or NCL VS. without cleaning data. The experimental results make clear that learning models obtain significantly better performance in terms of balance, Recall and AUC for both WPDP and CPDP when the overlapping instances are removed. Moreover, it is better to consider both class overlap and class imbalance.",5
148,conf/icse/ChenSMXL18,icse/icse,2018,From UI design image to GUI skeleton: a neural machine translator to bootstrap mobile GUI implementation.,"Chunyang Chen,Ting Su,Guozhu Meng,Zhenchang Xing,Yang Liu","ABSTRACTA GUI skeleton is the starting point for implementing a UI design image. To obtain a GUI skeleton from a UI design image, developers have to visually understand UI elements and their spatial layout in the image, and then translate this understanding into proper GUI components and their compositions. Automating this visual understanding and translation would be beneficial for bootstraping mobile GUI implementation, but it is a challenging task due to the diversity of UI designs and the complexity of GUI skeletons to generate. Existing tools are rigid as they depend on heuristically-designed visual understanding and GUI generation rules. In this paper, we present a neural machine translator that combines recent advances in computer vision and machine translation for translating a UI design image into a GUI skeleton. Our translator learns to extract visual features in UI images, encode these features' spatial layouts, and generate GUI skeletons in a unified neural network framework, without requiring manual rule development. For training our translator, we develop an automated GUI exploration method to automatically collect large-scale UI data from real-world applications. We carry out extensive experiments to evaluate the accuracy, generality and usefulness of our approach.",5
1017,conf/kbse/UdeshiAC18,kbse/ase,2018,Automated directed fairness testing.,"Sakshi Udeshi,Pryanshu Arora,Sudipta Chattopadhyay","ABSTRACTFairness is a critical trait in decision making. As machine-learning models are increasingly being used in sensitive application domains (e.g. education and employment) for decision making, it is crucial that the decisions computed by such models are free of unintended bias. But how can we automatically validate the fairness of arbitrary machine-learning models? For a given machine-learning model and a set of sensitive input parameters, our Aeqitas approach automatically discovers discriminatory inputs that highlight fairness violation. At the core of Aeqitas are three novel strategies to employ probabilistic search over the input space with the objective of uncovering fairness violation. Our Aeqitas approach leverages inherent robustness property in common machine-learning models to design and implement scalable test generation methodologies. An appealing feature of our generated test inputs is that they can be systematically added to the training set of the underlying model and improve its fairness. To this end, we design a fully automated module that guarantees to improve the fairness of the model. We implemented Aeqitas and we have evaluated it on six stateof- the-art classifiers. Our subjects also include a classifier that was designed with fairness in mind. We show that Aeqitas effectively generates inputs to uncover fairness violation in all the subject classifiers and systematically improves the fairness of respective models using the generated test inputs. In our evaluation, Aeqitas generates up to 70% discriminatory inputs (w.r.t. the total number of inputs generated) and leverages these inputs to improve the fairness up to 94%.",5
0,conf/icse/0004CC17,icse/icse,2017,Semantically enhanced software traceability using deep learning techniques.,"Jin Guo,Jinghui Cheng,Jane Cleland-Huang","In most safety-critical domains the need for traceability is prescribed by certifying bodies. Trace links are generally created among requirements, design, source code, test cases and other artifacts, however, creating such links manually is time consuming and error prone. Automated solutions use information retrieval and machine learning techniques to generate trace links, however, current techniques fail to understand semantics of the software artifacts or to integrate domain knowledge into the tracing process and therefore tend to deliver imprecise and inaccurate results. In this paper, we present a solution that uses deep learning to incorporate requirements artifact semantics and domain knowledge into the tracing solution. We propose a tracing network architecture that utilizes Word Embedding and Recurrent Neural Network (RNN) models to generate trace links. Word embedding learns word vectors that represent knowledge of the domain corpus and RNN uses these word vectors to learn the sentence semantics of requirements artifacts. We trained 360 different configurations of the tracing network using existing trace links in the Positive Train Control domain and identified the Bidirectional Gated Recurrent Unit (BI-GRU) as the best model for the tracing task. BI-GRU significantly out-performed state-of-the-art tracing methods including the Vector Space Model and Latent Semantic Indexing.",5
1213,conf/kbse/AmreenKM19,kbse/ase,2019,Developer Reputation Estimator (DRE).,"Sadika Amreen,Andrey Karnauch,Audris Mockus","Evidence shows that developer reputation is extremely important when accepting pull requests or resolving reported issues. It is particularly salient in Free/Libre Open Source Software since the developers are distributed around the world, do not work for the same organization and, in most cases, never meet face to face. The existing solutions to expose developer reputation tend to be forge specific (GitHub), focus on activity instead of impact, do not leverage social or technical networks, and do not correct often misspelled developer identities. We aim to remedy this by amalgamating data from all public Git repositories, measuring the impact of developer work, expose developer's collaborators, and correct notoriously problematic developer identity data. We leverage World of Code (WoC), a collection of an almost complete (and continuously updated) set of Git repositories by first allowing developers to select which of the 34 million(M) Git commit author IDs belong to them and then generating their profiles by treating the selected collection of IDs as that single developer. As a side-effect, these selections serve as a training set for a supervised learning algorithm that merges multiple identity strings belonging to a single individual. As we evaluate the tool and the proposed impact measure, we expect to build on these findings to develop reputation badges that could be associated with pull requests and commits so developers could easier trust and prioritize them.",5
559,conf/sigsoft/HellendoornD17,sigsoft/fse,2017,Are deep neural networks the best choice for modeling source code?,"Vincent J. Hellendoorn,Premkumar T. Devanbu","ABSTRACTCurrent statistical language modeling techniques, including deep-learning based models, have proven to be quite effective for source code. We argue here that the special properties of source code can be exploited for further improvements. In this work, we enhance established language modeling approaches to handle the special challenges of modeling source code, such as: frequent changes, larger, changing vocabularies, deeply nested scopes, etc. We present a fast, nested language modeling toolkit specifically designed for software, with the ability to add & remove text, and mix & swap out many models. Specifically, we improve upon prior cache-modeling work and present a model with a much more expansive, multi-level notion of locality that we show to be well-suited for modeling software. We present results on varying corpora in comparison with traditional N-gram, as well as RNN, and LSTM deep-learning language models, and release all our source code for public use. Our evaluations suggest that carefully adapting N-gram models for source code can yield performance that surpasses even RNN and LSTM based deep-learning models.",5
448,conf/icst/SharmaW19,icst/icst,2019,Testing Machine Learning Algorithms for Balanced Data Usage.,"Arnab Sharma,Heike Wehrheim","With the increased application of machine learning (ML) algorithms to decision-making processes, the question of fairness of such algorithms came into the focus. Fairness testing aims at checking whether a classifier as ""learned"" by an ML algorithm on some training data is biased in the sense of discriminating against some of the attributes (e.g. gender or age). Fairness testing thus targets the prediction phase in ML, not the learning phase. In this paper, we investigate fairness for the learning phase. Our definition of fairness is based on the idea that the learner should treat all data in the training set equally, disregarding issues like names or orderings of features or orderings of data instances. We term this property balanced data usage. We consequently develop a (metamorphic) testing approach called TiLe for checking balanced data usage. TiLe is applied on 14 ML classifiers taken from the scikit-learn library using 4 artificial and 9 real-world data sets for training, finding 12 of the classifiers to be unbalanced.",5
310,conf/icse/KimFY19,icse/icse,2019,Guiding deep learning system testing using surprise adequacy.,"Jinhan Kim,Robert Feldt,Shin Yoo","Deep Learning (DL) systems are rapidly being adopted in safety and security critical domains, urgently calling for ways to test their correctness and robustness. Testing of DL systems has traditionally relied on manual collection and labelling of data. Recently, a number of coverage criteria based on neuron activation values have been proposed. These criteria essentially count the number of neurons whose activation during the execution of a DL system satisfied certain properties, such as being above predefined thresholds. However, existing coverage criteria are not sufficiently fine grained to capture subtle behaviours exhibited by DL systems. Moreover, evaluations have focused on showing correlation between adversarial examples and proposed criteria rather than evaluating and guiding their use for actual testing of DL systems. We propose a novel test adequacy criterion for testing of DL systems, called Surprise Adequacy for Deep Learning Systems (SADL), which is based on the behaviour of DL systems with respect to their training data. We measure the surprise of an input as the difference in DL system's behaviour between the input and the training data (i.e., what was learnt during training), and subsequently develop this as an adequacy criterion: a good test input should be sufficiently but not overtly surprising compared to training data. Empirical evaluation using a range of DL systems from simple image classifiers to autonomous driving car platforms shows that systematic sampling of inputs based on their surprise can improve classification accuracy of DL systems against adversarial examples by up to 77.5% via retraining.",5
413,conf/icst/MarianiMPRX18,icst/icst,2018,Localizing Faults in Cloud Systems.,"Leonardo Mariani,Cristina Monni,Mauro Pezzè,Oliviero Riganelli,Rui Xin","By leveraging large clusters of commodity hardware, the Cloud offers great opportunities to optimize the operative costs of software systems, but impacts significantly on the reliability of software applications. The lack of control of applications over Cloud execution environments largely limits the applicability of state-of-the-art approaches that address reliability issues by relying on heavyweight training with injected faults. In this paper, we propose LOUD, a lightweight fault localization approach that relies on positive training only, and can thus operate within the constraints of Cloud systems. LOUD relies on machine learning and graph theory. It trains machine learning models with correct executions only, and compensates the inaccuracy that derives from training with positive samples, by elaborating the outcome of machine learning techniques with graph theory algorithms. The experimental results reported in this paper confirm that LOUD can localize faults with high precision, by relying only on a lightweight positive training.",5
455,conf/icst/JoffeC19,icst/icst,2019,Directing a Search Towards Execution Properties with a Learned Fitness Function.,"Leonid Joffe,David Clark","Search based software testing is a popular and successful approach both in academia and industry. SBST methods typically aim to increase coverage whereas searching for executions with specific properties is largely unresearched. Fitness functions for execution properties often possess search landscapes that are difficult or intractable. We demonstrate how machine learning techniques can convert a property that is not searchable, in this case crashes, into one that is. Through experimentation on 6000 C programs drawn from the Codeflaws repository, we demonstrate a strong, program independent correlation between crashing executions and library function call patterns within those executions as discovered by a neural net. We then exploit the correlation to produce a searchable fitness landscape to modify American Fuzzy Lop, a widely used fuzz testing tool. On a test set of previously unseen programs drawn from Codeflaws, a search strategy based on a crash targeting fitness function outperformed a baseline in 80.1% of cases. The experiments were then repeated on three real world programs: the VLC media player, and the libjpeg and mpg321 libraries. The correlation between library call traces and crashes generalises as indicated by ROC AUC scores of 0.91, 0.88 and 0.61. The produced search landscape however is not convenient due to plateaus. This is likely because these programs do not use standard C libraries as often as do those in Codeflaws. This limitation can be overcome by considering a more powerful observation domain and a broader training corpus in future work. Despite limited generalisability of the experimental setup, this research opens new possibilities in the intersection of machine learning, fitness functions, and search based testing in general.",5
